title,link,company,salary,location,exp
Game Client Developer,https://www.topcv.vn/viec-lam/game-client-developer/1885078.html?ta_source=JobSearchList_LinkDetail&u_sr_id=D4syTnFr3lGPd7K0ulCymW7Kmie42uAVjT04o0vl_1759549983,CÔNG TY TNHH ULT VIỆT NAM,15 - 25 triệu,Hà Nội,1 năm
"Junior Fullstack Developers - Fintech, Ecommerce",https://www.topcv.vn/viec-lam/junior-fullstack-developers-fintech-ecommerce/1487371.html?ta_source=JobSearchList_LinkDetail&u_sr_id=D4syTnFr3lGPd7K0ulCymW7Kmie42uAVjT04o0vl_1759549983,CÔNG TY TNHH TÍCH HỢP CRM,Thoả thuận,Hà Nội,Dưới 1 năm
"Full Stack Developer (Java, Springboot, React)",https://www.topcv.vn/viec-lam/full-stack-developer-java-springboot-react/1783213.html?ta_source=JobSearchList_LinkDetail&u_sr_id=D4syTnFr3lGPd7K0ulCymW7Kmie42uAVjT04o0vl_1759549983,Công Ty TNHH LG CNS VIỆT NAM,Thoả thuận,Hà Nội,1 năm
Business Analyst (Yêu Cầu Tốt Nghiệp MBA),https://www.topcv.vn/brand/congtycophanmisa/tuyen-dung/business-analyst-yeu-cau-tot-nghiep-mba-j1895258.html?ta_source=JobSearchList_LinkDetail&u_sr_id=D4syTnFr3lGPd7K0ulCymW7Kmie42uAVjT04o0vl_1759549983,ProCông ty Cổ phần MISA,Thoả thuận,Hà Nội,2 năm
Senior IT Project Manager (Japanese Projects) - Thu Nhập Upto 3000 USD - Đi Làm Ngay (Hà Nội),https://www.topcv.vn/viec-lam/senior-it-project-manager-japanese-projects-thu-nhap-upto-3000-usd-di-lam-ngay-ha-noi/1894284.html?ta_source=JobSearchList_LinkDetail&u_sr_id=D4syTnFr3lGPd7K0ulCymW7Kmie42uAVjT04o0vl_1759549983,Công ty Cổ phần NTTe-MOI,"Tới 3,000 USD",Hà Nội,5 năm
Java Backend Leader,https://www.topcv.vn/viec-lam/java-backend-leader/1718449.html?ta_source=JobSearchList_LinkDetail&u_sr_id=D4syTnFr3lGPd7K0ulCymW7Kmie42uAVjT04o0vl_1759549983,Công ty cổ phần PayPay,Tới 50 triệu,Hà Nội,4 năm
Trưởng/Phó Phòng R&D,https://www.topcv.vn/viec-lam/truong-pho-phong-rd/1896253.html?ta_source=JobSearchList_LinkDetail&u_sr_id=D4syTnFr3lGPd7K0ulCymW7Kmie42uAVjT04o0vl_1759549983,CÔNG TY CỔ PHẦN TẬP ĐOÀN CÔNG NGHỆ IDEA,Thoả thuận,Hồ Chí Minh,Trên 5 năm
Nhân Viên Kỹ Thuật,https://www.topcv.vn/viec-lam/nhan-vien-ky-thuat/1899212.html?ta_source=JobSearchList_LinkDetail&u_sr_id=D4syTnFr3lGPd7K0ulCymW7Kmie42uAVjT04o0vl_1759549983,CÔNG TY TNHH GIẢI PHÁP THIÊN PHÚC HƯNG,Thoả thuận,Hà Nội,1 năm
3D Rigging Artist (Lương 25tr - 45tr) Tại Hồ Chí Minh - Yêu Cầu Bắt Buộc Nộp Portfolio,https://www.topcv.vn/viec-lam/3d-rigging-artist-luong-25tr-45tr-tai-ho-chi-minh-yeu-cau-bat-buoc-nop-portfolio/1736983.html?ta_source=JobSearchList_LinkDetail&u_sr_id=D4syTnFr3lGPd7K0ulCymW7Kmie42uAVjT04o0vl_1759549983,CÔNG TY TNHH VLAST VIỆT NAM,25 - 45 triệu,Hồ Chí Minh,Không yêu cầu
Senior UI UX Designer (Blockchain),https://www.topcv.vn/viec-lam/senior-ui-ux-designer-blockchain/1852014.html?ta_source=JobSearchList_LinkDetail&u_sr_id=D4syTnFr3lGPd7K0ulCymW7Kmie42uAVjT04o0vl_1759549983,CÔNG TY CỔ PHẦN 1MATRIX,Thoả thuận,Hà Nội,5 năm
Software Developer (C++/Golang),https://www.topcv.vn/viec-lam/software-developer-c-golang/1637012.html?ta_source=JobSearchList_LinkDetail&u_sr_id=D4syTnFr3lGPd7K0ulCymW7Kmie42uAVjT04o0vl_1759549983,AS SOLUTIONS,10 - 40 triệu,Hồ Chí Minh,Không yêu cầu
AI Engineer,https://www.topcv.vn/viec-lam/ai-engineer/1898979.html?ta_source=JobSearchList_LinkDetail&u_sr_id=D4syTnFr3lGPd7K0ulCymW7Kmie42uAVjT04o0vl_1759549983,CÔNG TY CỔ PHẦN CÔNG NGHỆ MOBIWORK VIỆT NAM,13 - 18 triệu,Hà Nội,1 năm
Nhân Viên Business Analyst,https://www.topcv.vn/viec-lam/nhan-vien-business-analyst/1646337.html?ta_source=JobSearchList_LinkDetail&u_sr_id=D4syTnFr3lGPd7K0ulCymW7Kmie42uAVjT04o0vl_1759549983,Công ty TNHH Phát triển công nghệ điện tử Bình Anh,15 - 20 triệu,Hà Nội,2 năm
Angular Developer,https://www.topcv.vn/viec-lam/angular-developer/1900040.html?ta_source=JobSearchList_LinkDetail&u_sr_id=D4syTnFr3lGPd7K0ulCymW7Kmie42uAVjT04o0vl_1759549983,Công ty cổ phần phần mềm ITSOL Holdings,15 - 22 triệu,Hà Nội,2 năm
Kỹ Sư Phần Mềm Nhúng - Senior,https://www.topcv.vn/viec-lam/ky-su-phan-mem-nhung-senior/1884101.html?ta_source=JobSearchList_LinkDetail&u_sr_id=D4syTnFr3lGPd7K0ulCymW7Kmie42uAVjT04o0vl_1759549983,VNPT Technology - Công ty Cổ phần Công nghệ Công nghiệp Bưu chính viễn thông,Thoả thuận,Hà Nội,2 năm
Chuyên Viên Kỹ Thuật Tư Vấn Giải Pháp (Presales)/ Presales Engineer,https://www.topcv.vn/viec-lam/chuyen-vien-ky-thuat-tu-van-giai-phap-presales-presales-engineer/1897397.html?ta_source=JobSearchList_LinkDetail&u_sr_id=D4syTnFr3lGPd7K0ulCymW7Kmie42uAVjT04o0vl_1759549983,CÔNG TY TNHH GIẢI PHÁP BẢO MẬT SỐ,Thoả thuận,Hà Nội,2 năm
Senior Devops (Thu Nhập 18 - 30 Triệu),https://www.topcv.vn/viec-lam/senior-devops-thu-nhap-18-30-trieu/1892974.html?ta_source=JobSearchList_LinkDetail&u_sr_id=D4syTnFr3lGPd7K0ulCymW7Kmie42uAVjT04o0vl_1759549983,CÔNG TY CỔ PHẦN CÔNG NGHỆ VINORSOFT,18 - 30 triệu,"Hồ Chí Minh, Hà Nội",3 năm
Senior Full-Stack Developer,https://www.topcv.vn/viec-lam/senior-full-stack-developer/1897298.html?ta_source=JobSearchList_LinkDetail&u_sr_id=D4syTnFr3lGPd7K0ulCymW7Kmie42uAVjT04o0vl_1759549983,CÔNG TY CỔ PHẦN CÔNG NGHỆ PHẦN MỀM NIK,Thoả thuận,Hồ Chí Minh,5 năm
.Net Developer (Từ 2 - 7 Năm Kinh Nghiệm),https://www.topcv.vn/viec-lam/net-developer-tu-2-7-nam-kinh-nghiem/1894111.html?ta_source=JobSearchList_LinkDetail&u_sr_id=D4syTnFr3lGPd7K0ulCymW7Kmie42uAVjT04o0vl_1759549983,ProCông ty Cổ phần Hệ thống Công nghệ ETC,15 - 40 triệu,Hà Nội,2 năm
"Nhân Viên Kinh Doanh Phần Mềm AI/ Sales B2B, Thu Nhập 15 - 30 Triệu, Nghỉ T7 Và CN - Hà Nội",https://www.topcv.vn/viec-lam/nhan-vien-kinh-doanh-phan-mem-ai-sales-b2b-thu-nhap-15-30-trieu-nghi-t7-va-cn-ha-noi/1891017.html?ta_source=JobSearchList_LinkDetail&u_sr_id=D4syTnFr3lGPd7K0ulCymW7Kmie42uAVjT04o0vl_1759549983,Công ty TNHH Truyền Thông Seodo,15 - 30 triệu,Hà Nội,1 năm
UX/UI Product Owner (Web/App),https://www.topcv.vn/viec-lam/ux-ui-product-owner-web-app/1898090.html?ta_source=JobSearchList_LinkDetail&u_sr_id=D4syTnFr3lGPd7K0ulCymW7Kmie42uAVjT04o0vl_1759549983,Khối Công nghệ thông tin - Viettel Telecom,Thoả thuận,Hà Nội,Không yêu cầu
Kỹ Sư Tích Hợp Hệ Thống,https://www.topcv.vn/viec-lam/ky-su-tich-hop-he-thong/1898207.html?ta_source=JobSearchList_LinkDetail&u_sr_id=D4syTnFr3lGPd7K0ulCymW7Kmie42uAVjT04o0vl_1759549983,Khối Công nghệ thông tin - Viettel Telecom,Thoả thuận,Hà Nội,1 năm
Frontend Developer - Thu Nhập Gross Upto 32 Triệu (Hỗ Trợ Ăn Trưa) Tại Hà Nội,https://www.topcv.vn/viec-lam/frontend-developer-thu-nhap-gross-upto-32-trieu-ho-tro-an-trua-tai-ha-noi/1885683.html?ta_source=JobSearchList_LinkDetail&u_sr_id=D4syTnFr3lGPd7K0ulCymW7Kmie42uAVjT04o0vl_1759549983,Open Reach Tech Hanoi,22 - 32 triệu,Hà Nội,2 năm
Web Creator / Wordpress/ PHP/ CSS,https://www.topcv.vn/viec-lam/web-creator-wordpress-php-css/747970.html?ta_source=JobSearchList_LinkDetail&u_sr_id=D4syTnFr3lGPd7K0ulCymW7Kmie42uAVjT04o0vl_1759549983,Công Ty TNHH Chiroro-Net Việt,18 - 25 triệu,Hồ Chí Minh,2 năm
Java Spring Boot,https://www.topcv.vn/viec-lam/java-spring-boot/1861350.html?ta_source=JobSearchList_LinkDetail&u_sr_id=D4syTnFr3lGPd7K0ulCymW7Kmie42uAVjT04o0vl_1759549983,CÔNG TY CỔ PHẦN TINASOFT VIỆT NAM,Tới 18 triệu,Hà Nội,2 năm
Business Analyst,https://www.topcv.vn/viec-lam/business-analyst/1893182.html?ta_source=JobSearchList_LinkDetail&u_sr_id=D4syTnFr3lGPd7K0ulCymW7Kmie42uAVjT04o0vl_1759549983,CÔNG TY TNHH ĐẦU TƯ THƯƠNG MẠI TBESTPRO,18 - 25 triệu,Hà Nội,1 năm
Nhân Viên Thiết Kế Nhận Việc Ngay,https://www.topcv.vn/viec-lam/nhan-vien-thiet-ke-nhan-viec-ngay/1508460.html?ta_source=JobSearchList_LinkDetail&u_sr_id=D4syTnFr3lGPd7K0ulCymW7Kmie42uAVjT04o0vl_1759549983,Công ty TNHH Hiwin Hongkong,8 - 9 triệu,Hà Nội,1 năm
"FullStack Developer (NodeJS, ReactJS, Vue JS) - Experience Above 04 Years",https://www.topcv.vn/viec-lam/fullstack-developer-nodejs-reactjs-vue-js-experience-above-04-years/1881978.html?ta_source=JobSearchList_LinkDetail&u_sr_id=D4syTnFr3lGPd7K0ulCymW7Kmie42uAVjT04o0vl_1759549983,Công ty TNHH AIRCLOSET ENGINEERING,Thoả thuận,Hà Nội,4 năm
Java Developer,https://www.topcv.vn/viec-lam/java-developer/744031.html?ta_source=JobSearchList_LinkDetail&u_sr_id=D4syTnFr3lGPd7K0ulCymW7Kmie42uAVjT04o0vl_1759549983,ProCông ty Tài chính tín dụng tiêu dùng TNHH MB SHINSEI (Mcredit),Thoả thuận,Hà Nội,4 năm
"Nhân Viên Kỹ Thuật In Ấn - Thu Nhập Đến 17 Triệu, Tại Đức Hòa",https://www.topcv.vn/viec-lam/nhan-vien-ky-thuat-in-an-thu-nhap-den-17-trieu-tai-duc-hoa/1895830.html?ta_source=JobSearchList_LinkDetail&u_sr_id=D4syTnFr3lGPd7K0ulCymW7Kmie42uAVjT04o0vl_1759549983,Công Ty TNHH Đầu Tư Cảnh Phong,12 - 17 triệu,Long An,1 năm
Senior/Middle Hybrid App Developer (Angular + Capacitor) - Làm Việc Remote,https://www.topcv.vn/viec-lam/senior-middle-hybrid-app-developer-angular-capacitor-lam-viec-remote/1888432.html?ta_source=JobSearchList_LinkDetail&u_sr_id=D4syTnFr3lGPd7K0ulCymW7Kmie42uAVjT04o0vl_1759549983,CÔNG TY TNHH CÔNG NGHỆ STARTECH AI,20 - 40 triệu,Hồ Chí Minh,1 năm
Thực Tập Sinh Kinh Doanh (Thu Nhập Hấp Dẫn),https://www.topcv.vn/viec-lam/thuc-tap-sinh-kinh-doanh-thu-nhap-hap-dan/1889055.html?ta_source=JobSearchList_LinkDetail&u_sr_id=D4syTnFr3lGPd7K0ulCymW7Kmie42uAVjT04o0vl_1759549983,CÔNG TY CỔ PHẦN SEPAY,Từ 4 triệu,Hồ Chí Minh,Không yêu cầu
Software Engineer (Java),https://www.topcv.vn/viec-lam/software-engineer-java/1889691.html?ta_source=JobSearchList_LinkDetail&u_sr_id=D4syTnFr3lGPd7K0ulCymW7Kmie42uAVjT04o0vl_1759549983,CÔNG TY TNHH VETC DIGITAL,"Tới 1,500 USD",Hà Nội,4 năm
Android Automotive Developer (Middle To Senior),https://www.topcv.vn/viec-lam/android-automotive-developer-middle-to-senior/1888745.html?ta_source=JobSearchList_LinkDetail&u_sr_id=D4syTnFr3lGPd7K0ulCymW7Kmie42uAVjT04o0vl_1759549983,"VĂN PHÒNG KOTRA, ĐẠI SỨ QUÁN HÀN QUỐC",Thoả thuận,Hà Nội,4 năm
"Engineering Manager (.NET, Hands-On )",https://www.topcv.vn/viec-lam/engineering-manager-net-hands-on/1889717.html?ta_source=JobSearchList_LinkDetail&u_sr_id=D4syTnFr3lGPd7K0ulCymW7Kmie42uAVjT04o0vl_1759549983,CÔNG TY CỔ PHẦN CÔNG NGHỆ AROBID,Thoả thuận,Hồ Chí Minh,Trên 5 năm
3D Artist – Lương Đến 17 Triệu (Hà Nội),https://www.topcv.vn/viec-lam/3d-artist-luong-den-17-trieu-ha-noi/1894340.html?ta_source=JobSearchList_LinkDetail&u_sr_id=D4syTnFr3lGPd7K0ulCymW7Kmie42uAVjT04o0vl_1759549983,CÔNG TY TNHH KATAYAMA YOKO VIỆT NAM,12 - 17 triệu,Hà Nội,3 năm
Nhân Viên Thiết Kế Bao Bì In Ấn / Graphic Designer _ 01 Năm Kinh Nghiệm _ Đi Làm Ngay Tại Hoàng Mai - HN,https://www.topcv.vn/viec-lam/nhan-vien-thiet-ke-bao-bi-in-an-graphic-designer-01-nam-kinh-nghiem-di-lam-ngay-tai-hoang-mai-hn/1883318.html?ta_source=JobSearchList_LinkDetail&u_sr_id=D4syTnFr3lGPd7K0ulCymW7Kmie42uAVjT04o0vl_1759549983,CÔNG TY TNHH DỊCH VỤ CHÍNH NGHĨA,10 - 15 triệu,Hà Nội,Không yêu cầu
Tester Ielts Không Yêu Cầu Kinh Nghiệm (Hà Nội & Hồ Chí Minh),https://www.topcv.vn/brand/edutalkvn/tuyen-dung/tester-ielts-khong-yeu-cau-kinh-nghiem-ha-noi-ho-chi-minh-j1828160.html?ta_source=JobSearchList_LinkDetail&u_sr_id=D4syTnFr3lGPd7K0ulCymW7Kmie42uAVjT04o0vl_1759549983,CÔNG TY CỔ PHẦN TƯ VẤN ĐÁNH GIÁ VÀ PHÁT TRIỂN GIÁO DỤC EDUTALK,8 - 12 triệu,"Hồ Chí Minh, Hà Nội",Không yêu cầu
Senior AI Engineer Cho Dự Án Fintech,https://www.topcv.vn/viec-lam/senior-ai-engineer-cho-du-an-fintech/1876748.html?ta_source=JobSearchList_LinkDetail&u_sr_id=D4syTnFr3lGPd7K0ulCymW7Kmie42uAVjT04o0vl_1759549983,CÔNG TY CỔ PHẦN CYPHER AI LABS,Thoả thuận,Hà Nội,Trên 5 năm
Nhân Viên Kinh Doanh /Sale Phần Mềm - Thu Nhập 10-15 Triệu - Khu Vực Hà Nội,https://www.topcv.vn/viec-lam/nhan-vien-kinh-doanh-sale-phan-mem-thu-nhap-10-15-trieu-khu-vuc-ha-noi/1880209.html?ta_source=JobSearchList_LinkDetail&u_sr_id=D4syTnFr3lGPd7K0ulCymW7Kmie42uAVjT04o0vl_1759549983,CÔNG TY TNHH CÔNG NGHỆ THÔNG TIN STREAMS,10 - 15 triệu,Hà Nội,Dưới 1 năm
"Nhân Viên Junior Designer (UI/UX) - Lương 12-18tr Tại Đà Nẵng, Không Yêu Cầu Kinh Nghiệm",https://www.topcv.vn/viec-lam/nhan-vien-junior-designer-ui-ux-luong-12-18tr-tai-da-nang-khong-yeu-cau-kinh-nghiem/1889578.html?ta_source=JobSearchList_LinkDetail&u_sr_id=D4syTnFr3lGPd7K0ulCymW7Kmie42uAVjT04o0vl_1759549983,Công ty tnhh thương mại immanuel,12 - 18 triệu,Đà Nẵng,Không yêu cầu
Nhân Viên Idea Creator (Ngành Print On Demand),https://www.topcv.vn/viec-lam/nhan-vien-idea-creator-nganh-print-on-demand/1779206.html?ta_source=JobSearchList_LinkDetail&u_sr_id=D4syTnFr3lGPd7K0ulCymW7Kmie42uAVjT04o0vl_1759549983,CÔNG TY TNHH VIKCOM,7 - 9 triệu,Hồ Chí Minh,Không yêu cầu
Product Designer - Up To 30 Months Salary,https://www.topcv.vn/viec-lam/product-designer-up-to-30-months-salary/1828997.html?ta_source=JobSearchList_LinkDetail&u_sr_id=D4syTnFr3lGPd7K0ulCymW7Kmie42uAVjT04o0vl_1759549983,Crossian,Thoả thuận,Hà Nội,3 năm
IT Comtor (Tiếng Nhật N2 Trở Lên) - Nghỉ T7 CN,https://www.topcv.vn/viec-lam/it-comtor-tieng-nhat-n2-tro-len-nghi-t7-cn/1889547.html?ta_source=JobSearchList_LinkDetail&u_sr_id=D4syTnFr3lGPd7K0ulCymW7Kmie42uAVjT04o0vl_1759549983,Công TY TNHH FLINTERS Việt Nam,"Tới 1,000 USD",Hà Nội,1 năm
Nhân Viên Nhập Liệu Biết Tiếng Nhật Yêu Cầu CV Tiếng Nhật,https://www.topcv.vn/viec-lam/nhan-vien-nhap-lieu-biet-tieng-nhat-yeu-cau-cv-tieng-nhat/1860069.html?ta_source=JobSearchList_LinkDetail&u_sr_id=D4syTnFr3lGPd7K0ulCymW7Kmie42uAVjT04o0vl_1759549983,CÔNG TY TNHH VIỆT NAM CAMCOM,8.5 - 12 triệu,Hà Nội,Không yêu cầu
Chuyên Viên Thiết Kế UI/UX - Từ 03 Năm Kinh Nghiệm - Thu Nhập Hấp Dẫn - Làm Việc Tại Hà Nội,https://www.topcv.vn/viec-lam/chuyen-vien-thiet-ke-ui-ux-tu-03-nam-kinh-nghiem-thu-nhap-hap-dan-lam-viec-tai-ha-noi/1890837.html?ta_source=JobSearchList_LinkDetail&u_sr_id=D4syTnFr3lGPd7K0ulCymW7Kmie42uAVjT04o0vl_1759549983,Công ty Cổ phần Tập đoàn TDI,Thoả thuận,Hà Nội,3 năm
Business Analyst,https://www.topcv.vn/viec-lam/business-analyst/1887317.html?ta_source=JobSearchList_LinkDetail&u_sr_id=D4syTnFr3lGPd7K0ulCymW7Kmie42uAVjT04o0vl_1759549983,CÔNG TY TNHH VETC DIGITAL,"Tới 1,500 USD",Hà Nội,4 năm
IT Business Analyst,https://www.topcv.vn/brand/shinhanfinance1/tuyen-dung/it-business-analyst-j1579507.html?ta_source=JobSearchList_LinkDetail&u_sr_id=D4syTnFr3lGPd7K0ulCymW7Kmie42uAVjT04o0vl_1759549983,ProSHINHAN FINANCE,Thoả thuận,Hồ Chí Minh,4 năm
Nữ Graphic Designer 2D (Không Cần Kinh Nghiệm),https://www.topcv.vn/viec-lam/nu-graphic-designer-2d-khong-can-kinh-nghiem/1758746.html?ta_source=JobSearchList_LinkDetail&u_sr_id=D4syTnFr3lGPd7K0ulCymW7Kmie42uAVjT04o0vl_1759549983,CÔNG TY TNHH VIKCOM,7 - 9 triệu,Hồ Chí Minh,Dưới 1 năm
Lập Trình Viên Mobile App/ Mobile Developer (App Tài Chính) - Thu Nhập Upto 20 Triệu - Làm Việc Từ Thứ 2 Đến Thứ 6,https://www.topcv.vn/viec-lam/lap-trinh-vien-mobile-app-mobile-developer-app-tai-chinh-thu-nhap-upto-20-trieu-lam-viec-tu-thu-2-den-thu-6/1891085.html?ta_source=JobSearchList_LinkDetail&u_sr_id=D4syTnFr3lGPd7K0ulCymW7Kmie42uAVjT04o0vl_1759549983,Công ty Cổ phần Tập đoàn Đầu tư EMIR,16 - 20 triệu,Hà Nội,3 năm
Lập Trình Viên Mobile App/ Mobile Developer (App Tài Chính) - Thu Nhập Upto 20 Triệu - Làm Việc Từ Thứ 2 Đến Thứ 6,https://www.topcv.vn/viec-lam/lap-trinh-vien-mobile-app-mobile-developer-app-tai-chinh-thu-nhap-upto-20-trieu-lam-viec-tu-thu-2-den-thu-6/1891085.html?ta_source=JobSearchList_LinkDetail&u_sr_id=9BWmfM365cZpxy9DjLduxSEeaZN3uyGpomV1wUac_1759549989,Công ty Cổ phần Tập đoàn Đầu tư EMIR,16 - 20 triệu,Hà Nội,3 năm
Senior/Leader QA Engineer,https://www.topcv.vn/viec-lam/senior-leader-qa-engineer/1894560.html?ta_source=JobSearchList_LinkDetail&u_sr_id=9BWmfM365cZpxy9DjLduxSEeaZN3uyGpomV1wUac_1759549989,CÔNG TY TNHH ALCHEMY TECHNOLOGIES,Thoả thuận,Hồ Chí Minh,3 năm
IT Project Manager - Lương Hấp Dẫn Từ 30M+++,https://www.topcv.vn/viec-lam/it-project-manager-luong-hap-dan-tu-30m/1884305.html?ta_source=JobSearchList_LinkDetail&u_sr_id=9BWmfM365cZpxy9DjLduxSEeaZN3uyGpomV1wUac_1759549989,CÔNG TY CỔ PHẦN FUTURE CONNECT,Từ 30 triệu,Hà Nội,3 năm
IT Maintenance & Troubleshooting Engineer (IT Engineer),https://www.topcv.vn/viec-lam/it-maintenance-troubleshooting-engineer-it-engineer/1893577.html?ta_source=JobSearchList_LinkDetail&u_sr_id=9BWmfM365cZpxy9DjLduxSEeaZN3uyGpomV1wUac_1759549989,CHI NHÁNH CÔNG TY TNHH KDDI VIỆT NAM TẠI THÀNH PHỐ HỒ CHÍ MINH,15 - 20 triệu,Hồ Chí Minh,1 năm
Lập Trình Viên Developer [Junior Level],https://www.topcv.vn/viec-lam/lap-trinh-vien-developer-junior-level/1757124.html?ta_source=JobSearchList_LinkDetail&u_sr_id=9BWmfM365cZpxy9DjLduxSEeaZN3uyGpomV1wUac_1759549989,CÔNG TY TNHH IDENTALSOFT VIỆT NAM,10 - 18 triệu,Hồ Chí Minh,Không yêu cầu
Nhân Viên IT - Lương Đến 18 Triệu,https://www.topcv.vn/viec-lam/nhan-vien-it-luong-den-18-trieu/1883811.html?ta_source=JobSearchList_LinkDetail&u_sr_id=9BWmfM365cZpxy9DjLduxSEeaZN3uyGpomV1wUac_1759549989,Công ty Cổ phần Thú y xanh Việt Nam,16 - 18 triệu,Hà Nội,1 năm
"Nhân Viên Phân Tích Nghiệp Vụ Công Nghệ Thông Tin (BA), Tối Thiểu Từ 2 Năm Kinh Nghiệm - Thu Nhập Upto 25 Triệu (Hỗ Trợ Ăn Trưa) Tại Hà Nội",https://www.topcv.vn/viec-lam/nhan-vien-phan-tich-nghiep-vu-cong-nghe-thong-tin-ba-toi-thieu-tu-2-nam-kinh-nghiem-thu-nhap-upto-25-trieu-ho-tro-an-trua-tai-ha-noi/1885807.html?ta_source=JobSearchList_LinkDetail&u_sr_id=9BWmfM365cZpxy9DjLduxSEeaZN3uyGpomV1wUac_1759549989,Công ty cổ phần Đầu tư Bất động sản Hapulico,15 - 25 triệu,Hà Nội,2 năm
Embedded Software Engineer Thu Nhập Thỏa Thuận Tại Hà Nội,https://www.topcv.vn/viec-lam/embedded-software-engineer-thu-nhap-thoa-thuan-tai-ha-noi/1823934.html?ta_source=JobSearchList_LinkDetail&u_sr_id=9BWmfM365cZpxy9DjLduxSEeaZN3uyGpomV1wUac_1759549989,CÔNG TY CỔ PHẦN ĐIỆN TỬ SOJI,Thoả thuận,Hà Nội,1 năm
.NET Developer - 02 Năm Kinh Nghiệm - Lương 15 Đến 20 Triệu + Phụ Cấp + Thưởng - Thanh Xuân (Hà Nội),https://www.topcv.vn/viec-lam/net-developer-02-nam-kinh-nghiem-luong-15-den-20-trieu-phu-cap-thuong-thanh-xuan-ha-noi/1862748.html?ta_source=JobSearchList_LinkDetail&u_sr_id=9BWmfM365cZpxy9DjLduxSEeaZN3uyGpomV1wUac_1759549989,CÔNG TY CỔ PHẦN VIỄN THÔNG INTERCOM VIỆT NAM,15 - 20 triệu,Hà Nội,2 năm
Flutter Developer Kiêm Fullstack Developer - Thu Nhập Upto 18 Triệu (Thưởng Năng Suất Và Lợi Nhuận) Tại Hà Nội,https://www.topcv.vn/viec-lam/flutter-developer-kiem-fullstack-developer-thu-nhap-upto-18-trieu-thuong-nang-suat-va-loi-nhuan-tai-ha-noi/1885011.html?ta_source=JobSearchList_LinkDetail&u_sr_id=9BWmfM365cZpxy9DjLduxSEeaZN3uyGpomV1wUac_1759549989,CÔNG TY CỔ PHẦN THƯƠNG MẠI ĐIỆN TỬ BẢO KIM,12 - 18 triệu,Hà Nội,1 năm
Business Analyst,https://www.topcv.vn/viec-lam/business-analyst/1884483.html?ta_source=JobSearchList_LinkDetail&u_sr_id=9BWmfM365cZpxy9DjLduxSEeaZN3uyGpomV1wUac_1759549989,CÔNG TY CỔ PHẦN GIẢI PHÁP CÔNG NGHỆ CARO,15 - 30 triệu,Hà Nội,3 năm
Nhân Viên Front End Developer - Chỉ Tuyển Nữ,https://www.topcv.vn/viec-lam/nhan-vien-front-end-developer-chi-tuyen-nu/1890433.html?ta_source=JobSearchList_LinkDetail&u_sr_id=9BWmfM365cZpxy9DjLduxSEeaZN3uyGpomV1wUac_1759549989,CÔNG TY TNHH TRUYỀN THÔNG SKY ADS VIỆT NAM,8 - 15 triệu,Hà Nội,1 năm
Phân Tích Nghiệp Vụ - BA,https://www.topcv.vn/viec-lam/phan-tich-nghiep-vu-ba/1850222.html?ta_source=JobSearchList_LinkDetail&u_sr_id=9BWmfM365cZpxy9DjLduxSEeaZN3uyGpomV1wUac_1759549989,Công ty cổ phần FDS,Thoả thuận,Hà Nội,3 năm
PHP Web Developer,https://www.topcv.vn/viec-lam/php-web-developer/1890951.html?ta_source=JobSearchList_LinkDetail&u_sr_id=9BWmfM365cZpxy9DjLduxSEeaZN3uyGpomV1wUac_1759549989,CÔNG TY TRÁCH NHIỆM HỮU HẠN THK HOLDINGS VIỆT NAM,Thoả thuận,Hồ Chí Minh,3 năm
"Nhân Viên Kinh Doanh Phần Mềm, Lương Cứng 7 - 15 Triệu, Nghỉ T7, CN (Hồ Chí Minh, Hà Nội)",https://www.topcv.vn/viec-lam/nhan-vien-kinh-doanh-phan-mem-luong-cung-7-15-trieu-nghi-t7-cn-ho-chi-minh-ha-noi/1793951.html?ta_source=JobSearchList_LinkDetail&u_sr_id=9BWmfM365cZpxy9DjLduxSEeaZN3uyGpomV1wUac_1759549989,Công ty TNHH MTV công nghệ AN VUI,Từ 30 triệu,"Hà Nội, Hồ Chí Minh",Không yêu cầu
Nhân Viên Thiết Kế Designer _ Hà Nội _  Đà Nẵng _ Lương Upto 10 Triệu _ Không Yêu Cầu Kinh Nghiệm,https://www.topcv.vn/viec-lam/nhan-vien-thiet-ke-designer-ha-noi-da-nang-luong-upto-10-trieu-khong-yeu-cau-kinh-nghiem/1886959.html?ta_source=JobSearchList_LinkDetail&u_sr_id=9BWmfM365cZpxy9DjLduxSEeaZN3uyGpomV1wUac_1759549989,CÔNG TY TNHH MODOBOM QUỐC TẾ,7 - 10 triệu,"Đà Nẵng, Hà Nội",Không yêu cầu
Kỹ Thuật Quản Trị Cơ Sở Dữ Liệu - DBA - Thu Nhập Upto 35 Triệu Đồng - 1 Năm Kinh Nghiệm,https://www.topcv.vn/viec-lam/ky-thuat-quan-tri-co-so-du-lieu-dba-thu-nhap-upto-35-trieu-dong-1-nam-kinh-nghiem/1897732.html?ta_source=JobSearchList_LinkDetail&u_sr_id=9BWmfM365cZpxy9DjLduxSEeaZN3uyGpomV1wUac_1759549989,Công ty cổ phần Onenet,15 - 35 triệu,Hà Nội,1 năm
Data Analyst/ Reporting Associate,https://www.topcv.vn/brand/shinhanfinance1/tuyen-dung/data-analyst-reporting-associate-j1884425.html?ta_source=JobSearchList_LinkDetail&u_sr_id=9BWmfM365cZpxy9DjLduxSEeaZN3uyGpomV1wUac_1759549989,ProSHINHAN FINANCE,Thoả thuận,Hồ Chí Minh,1 năm
Quản Lý Dự Án Triển Khai (IT Project Manager),https://www.topcv.vn/viec-lam/quan-ly-du-an-trien-khai-it-project-manager/1684269.html?ta_source=JobSearchList_LinkDetail&u_sr_id=9BWmfM365cZpxy9DjLduxSEeaZN3uyGpomV1wUac_1759549989,Công ty cổ phần công nghệ Isofh,Thoả thuận,"Hà Nội, Hồ Chí Minh",1 năm
Chương Trình Đào Tạo IT Fresher - Testing Engineer - The Rookie2Engineer - Offer Up To 17M,https://www.topcv.vn/viec-lam/chuong-trinh-dao-tao-it-fresher-testing-engineer-the-rookie2engineer-offer-up-to-17m/1895731.html?ta_source=JobSearchList_LinkDetail&u_sr_id=9BWmfM365cZpxy9DjLduxSEeaZN3uyGpomV1wUac_1759549989,NashTech,Thoả thuận,"Hồ Chí Minh, Hà Nội",Không yêu cầu
Designer / Retoucher Thẩm Mỹ Quận 10 Thu Nhập Hấp Dẫn,https://www.topcv.vn/viec-lam/designer-retoucher-tham-my-quan-10-thu-nhap-hap-dan/1184953.html?ta_source=JobSearchList_LinkDetail&u_sr_id=9BWmfM365cZpxy9DjLduxSEeaZN3uyGpomV1wUac_1759549989,Măng Beauty Studio,12 - 16 triệu,Hồ Chí Minh,1 năm
Frontend Developer - Từ 03 Năm Kinh Nghiệm - Thu Nhập Hấp Dẫn,https://www.topcv.vn/viec-lam/frontend-developer-tu-03-nam-kinh-nghiem-thu-nhap-hap-dan/1891528.html?ta_source=JobSearchList_LinkDetail&u_sr_id=9BWmfM365cZpxy9DjLduxSEeaZN3uyGpomV1wUac_1759549989,Công ty Cổ phần Tập đoàn TDI,Thoả thuận,Hà Nội,3 năm
Nhân Viên Hỗ Trợ Dự Án,https://www.topcv.vn/viec-lam/nhan-vien-ho-tro-du-an/1898193.html?ta_source=JobSearchList_LinkDetail&u_sr_id=9BWmfM365cZpxy9DjLduxSEeaZN3uyGpomV1wUac_1759549989,Khối Công nghệ thông tin - Viettel Telecom,Thoả thuận,Hà Nội,1 năm
Senior Designer 2D (Mức Lương Từ 15 Triệu),https://www.topcv.vn/viec-lam/senior-designer-2d-muc-luong-tu-15-trieu/1887015.html?ta_source=JobSearchList_LinkDetail&u_sr_id=9BWmfM365cZpxy9DjLduxSEeaZN3uyGpomV1wUac_1759549989,CÔNG TY CỔ PHẦN HỢP TÁC VÀ PHÁT TRIỂN TRUYỀN THÔNG NBN,Từ 15 triệu,Hồ Chí Minh,3 năm
"Nhân Viên Kinh Doanh Phần Mềm/ Sales B2B/ Nhân Viên Tư Vấn, Thu Nhập 15 - 40 Triệu, Nghỉ Thứ 7 Và Chủ Nhật, Đi Làm Ngay - Hồ Chí Minh",https://www.topcv.vn/viec-lam/nhan-vien-kinh-doanh-phan-mem-sales-b2b-nhan-vien-tu-van-thu-nhap-15-40-trieu-nghi-thu-7-va-chu-nhat-di-lam-ngay-ho-chi-minh/1883960.html?ta_source=JobSearchList_LinkDetail&u_sr_id=9BWmfM365cZpxy9DjLduxSEeaZN3uyGpomV1wUac_1759549989,CÔNG TY TNHH CNV HOLDINGS,15 - 40 triệu,Hồ Chí Minh,Dưới 1 năm
Thiết Kế Đồ Họa/ Graphic Designer - Ưu Tiên NỮ - 1 Năm Kinh Nghiệm - Nghỉ Thứ 7 - CN - Thu Nhập Upto 20M - Tại Hà Nội,https://www.topcv.vn/viec-lam/thiet-ke-do-hoa-graphic-designer-uu-tien-nu-1-nam-kinh-nghiem-nghi-thu-7-cn-thu-nhap-upto-20m-tai-ha-noi/1899574.html?ta_source=JobSearchList_LinkDetail&u_sr_id=9BWmfM365cZpxy9DjLduxSEeaZN3uyGpomV1wUac_1759549989,CÔNG TY CỔ PHẦN SMARTMOVE VIỆT NAM,Tới 20 triệu,Hà Nội,1 năm
Nhân Viên Kinh Doanh Ngành Game,https://www.topcv.vn/viec-lam/nhan-vien-kinh-doanh-nganh-game/1797374.html?ta_source=JobSearchList_LinkDetail&u_sr_id=9BWmfM365cZpxy9DjLduxSEeaZN3uyGpomV1wUac_1759549989,CÔNG TY CỔ PHẦN SMARTSCALE,Thoả thuận,Hồ Chí Minh,Dưới 1 năm
Software Tester,https://www.topcv.vn/viec-lam/software-tester/1665902.html?ta_source=JobSearchList_LinkDetail&u_sr_id=9BWmfM365cZpxy9DjLduxSEeaZN3uyGpomV1wUac_1759549989,"INFINIQ Vietnam Co.,ltd",Thoả thuận,Hà Nội,Dưới 1 năm
Lập Trình Viên VueJS,https://www.topcv.vn/viec-lam/lap-trinh-vien-vuejs/1893753.html?ta_source=JobSearchList_LinkDetail&u_sr_id=9BWmfM365cZpxy9DjLduxSEeaZN3uyGpomV1wUac_1759549989,Công ty cổ phần FDS,Thoả thuận,Hà Nội,2 năm
