title,link,company,salary,location,exp
Nhân Viên IT Helpdesk,https://www.topcv.vn/viec-lam/nhan-vien-it-helpdesk/1891300.html?ta_source=JobSearchList_LinkDetail&u_sr_id=9BWmfM365cZpxy9DjLduxSEeaZN3uyGpomV1wUac_1759549989,Công Ty TNHH Bảo Hiểm Tasco,Thoả thuận,Hà Nội,3 năm
Graphic Designer,https://www.topcv.vn/viec-lam/graphic-designer/1556162.html?ta_source=JobSearchList_LinkDetail&u_sr_id=9BWmfM365cZpxy9DjLduxSEeaZN3uyGpomV1wUac_1759549989,CÔNG TY TNHH DH VENTURES VIETNAM,12 - 18 triệu,Hồ Chí Minh,1 năm
Nhân Viên Kinh Doanh - Quản Lý Khách Hàng (AM),https://www.topcv.vn/viec-lam/nhan-vien-kinh-doanh-quan-ly-khach-hang-am/1897428.html?ta_source=JobSearchList_LinkDetail&u_sr_id=9BWmfM365cZpxy9DjLduxSEeaZN3uyGpomV1wUac_1759549989,CÔNG TY TNHH GIẢI PHÁP BẢO MẬT SỐ,Thoả thuận,Hà Nội,2 năm
Mobile Developer (IOS/Android) - Fresher - Khu Vực Quận 7 (TP.HCM),https://www.topcv.vn/viec-lam/mobile-developer-ios-android-fresher-khu-vuc-quan-7-tp-hcm/1892153.html?ta_source=JobSearchList_LinkDetail&u_sr_id=9BWmfM365cZpxy9DjLduxSEeaZN3uyGpomV1wUac_1759549989,CÔNG TY TNHH ANH PHÁT,10 - 12 triệu,Hồ Chí Minh,Không yêu cầu
Back-End Developer,https://www.topcv.vn/viec-lam/back-end-developer/1888410.html?ta_source=JobSearchList_LinkDetail&u_sr_id=9BWmfM365cZpxy9DjLduxSEeaZN3uyGpomV1wUac_1759549989,CÔNG TY TNHH GLODIVAL,9 - 12 triệu,Hồ Chí Minh,Không yêu cầu
Thực Tập Sinh Tư Vấn Triển Khai Phần Mềm ( Full Time),https://www.topcv.vn/viec-lam/thuc-tap-sinh-tu-van-trien-khai-phan-mem-full-time/1855187.html?ta_source=JobSearchList_LinkDetail&u_sr_id=9BWmfM365cZpxy9DjLduxSEeaZN3uyGpomV1wUac_1759549989,CÔNG TY TNHH CÔNG NGHỆ PHẦN MỀM NASANI,4 - 10 triệu,Hồ Chí Minh,Không yêu cầu
"Kỹ Sư Lập Trình Ứng Dụng Vision-Tự Động Hóa (Có Kinh Nghiệm Lập Trình PLC / HMI; Ngôn Ngữ Lập Trình C / C++, C#, VB, Python)",https://www.topcv.vn/viec-lam/ky-su-lap-trinh-ung-dung-vision-tu-dong-hoa-co-kinh-nghiem-lap-trinh-plc-hmi-ngon-ngu-lap-trinh-c-c-c-vb-python/1881826.html?ta_source=JobSearchList_LinkDetail&u_sr_id=9BWmfM365cZpxy9DjLduxSEeaZN3uyGpomV1wUac_1759549989,CÔNG TY TNHH TDMK,Thoả thuận,Hà Nội,1 năm
Nhân Viên Tư Vấn Bán Hàng B2B/ Kinh Doanh Bán Hàng (Phần Mềm Quản Lý Bán Hàng) - Thu Nhập Trung Bình Từ 15 Triệu Đến 40 Triệu + Thưởng KPI,https://www.topcv.vn/viec-lam/nhan-vien-tu-van-ban-hang-b2b-kinh-doanh-ban-hang-phan-mem-quan-ly-ban-hang-thu-nhap-trung-binh-tu-15-trieu-den-40-trieu-thuong-kpi/1591912.html?ta_source=JobSearchList_LinkDetail&u_sr_id=9BWmfM365cZpxy9DjLduxSEeaZN3uyGpomV1wUac_1759549989,CÔNG TY TNHH BIGSELLER TECHNOLOGY (VIỆT NAM),15 - 40 triệu,"Hồ Chí Minh, Hà Nội",2 năm
Nhân Viên Graphic Designer,https://www.topcv.vn/viec-lam/nhan-vien-graphic-designer/1881748.html?ta_source=JobSearchList_LinkDetail&u_sr_id=9BWmfM365cZpxy9DjLduxSEeaZN3uyGpomV1wUac_1759549989,CÔNG TY TNHH ANYTAPE VIỆT NAM,Thoả thuận,Hồ Chí Minh,2 năm
Nhân Viên Kinh Doanh/ Tư Vấn Công Nghệ/ Tư Vấn Bán Hàng/ Sale IT Thu Nhập Từ 10 - 20 Triệu Tại Hà Nội,https://www.topcv.vn/viec-lam/nhan-vien-kinh-doanh-tu-van-cong-nghe-tu-van-ban-hang-sale-it-thu-nhap-tu-10-20-trieu-tai-ha-noi/1899786.html?ta_source=JobSearchList_LinkDetail&u_sr_id=9BWmfM365cZpxy9DjLduxSEeaZN3uyGpomV1wUac_1759549989,CÔNG TY CỔ PHẦN RAPIDA TECHNOLOGIES,10 - 20 triệu,Hà Nội,Dưới 1 năm
Senior Backend Developer (Golang Prefer),https://www.topcv.vn/viec-lam/senior-backend-developer-golang-prefer/1883361.html?ta_source=JobSearchList_LinkDetail&u_sr_id=9BWmfM365cZpxy9DjLduxSEeaZN3uyGpomV1wUac_1759549989,CÔNG TY TNHH MỘT THÀNH VIÊN ATHENA HUB,30 - 50 triệu,Hồ Chí Minh,4 năm
Lập Trình Viên IOS (Mobile Apps),https://www.topcv.vn/viec-lam/lap-trinh-vien-ios-mobile-apps/1895155.html?ta_source=JobSearchList_LinkDetail&u_sr_id=9BWmfM365cZpxy9DjLduxSEeaZN3uyGpomV1wUac_1759549989,Công ty Cổ phần INFINITY TECHNOLOGY GLOBAL,18 - 30 triệu,Hà Nội,3 năm
Site Reliability Engineer (SRE),https://www.topcv.vn/viec-lam/site-reliability-engineer-sre/1862689.html?ta_source=JobSearchList_LinkDetail&u_sr_id=9BWmfM365cZpxy9DjLduxSEeaZN3uyGpomV1wUac_1759549989,ProCông ty cổ phần Tasco,Thoả thuận,Hà Nội,2 năm
Phó Phòng Công Nghệ Thông Tin (Mảng Tài Chính) - Thu Nhập Upto 40 Triệu - Làm Việc Từ Thứ 2 Đến Thứ 6,https://www.topcv.vn/viec-lam/pho-phong-cong-nghe-thong-tin-mang-tai-chinh-thu-nhap-upto-40-trieu-lam-viec-tu-thu-2-den-thu-6/1891530.html?ta_source=JobSearchList_LinkDetail&u_sr_id=9BWmfM365cZpxy9DjLduxSEeaZN3uyGpomV1wUac_1759549989,Công ty Cổ phần Tập đoàn Đầu tư EMIR,30 - 40 triệu,Hà Nội,5 năm
Lập Trình Viên Android,https://www.topcv.vn/viec-lam/lap-trinh-vien-android/1884178.html?ta_source=JobSearchList_LinkDetail&u_sr_id=9BWmfM365cZpxy9DjLduxSEeaZN3uyGpomV1wUac_1759549989,EZTech & CDT Games Studio,20 - 30 triệu,Hà Nội,2 năm
DEV - Embedded Software Engineer,https://www.topcv.vn/viec-lam/dev-embedded-software-engineer/1874980.html?ta_source=JobSearchList_LinkDetail&u_sr_id=9BWmfM365cZpxy9DjLduxSEeaZN3uyGpomV1wUac_1759549989,"VĂN PHÒNG ĐẠI DIỆN KAON GROUP CO., LTD TẠI THÀNH PHỐ HÀ NỘI",Thoả thuận,Hà Nội,3 năm
Sales B2B/ Business Consultant /Sales Giải Pháp Chuyển Đổi Số- Up To 20M,https://www.topcv.vn/viec-lam/sales-b2b-business-consultant-sales-giai-phap-chuyen-doi-so-up-to-20m/1862049.html?ta_source=JobSearchList_LinkDetail&u_sr_id=9BWmfM365cZpxy9DjLduxSEeaZN3uyGpomV1wUac_1759549989,Công ty Cổ Phần Base Enterprise,12 - 20 triệu,Hồ Chí Minh,1 năm
DevOps Engineer (Azure)- Up To 50M,https://www.topcv.vn/viec-lam/devops-engineer-azure-up-to-50m/1894887.html?ta_source=JobSearchList_LinkDetail&u_sr_id=9BWmfM365cZpxy9DjLduxSEeaZN3uyGpomV1wUac_1759549989,Công Ty TNHH NTT DATA VDS,30 - 50 triệu,Hà Nội,2 năm
Backend Developer (Python) Senior Level | Lương Upto 40 Triệu++,https://www.topcv.vn/viec-lam/backend-developer-python-senior-level-luong-upto-40-trieu/1785633.html?ta_source=JobSearchList_LinkDetail&u_sr_id=9BWmfM365cZpxy9DjLduxSEeaZN3uyGpomV1wUac_1759549989,CÔNG TY TNHH VODAPLAY VIỆT NAM,Tới 40 triệu,Hà Nội,4 năm
DevOps Engineer,https://www.topcv.vn/brand/topcv/tuyen-dung/devops-engineer-j1823528.html?ta_source=JobSearchList_LinkDetail&u_sr_id=9BWmfM365cZpxy9DjLduxSEeaZN3uyGpomV1wUac_1759549989,Công ty Cổ phần TOPCV Việt Nam,Thoả thuận,Hà Nội,2 năm
"Junior Business Analyst At Bitel, Based In Peru  - Salary $1,100 - $1,400",https://www.topcv.vn/viec-lam/junior-business-analyst-at-bitel-based-in-peru-salary-1-100-1-400/1894336.html?ta_source=JobSearchList_LinkDetail&u_sr_id=9BWmfM365cZpxy9DjLduxSEeaZN3uyGpomV1wUac_1759549989,Viettel Peru,"1,100 - 1,400 USD",Nước Ngoài,1 năm
Senior Fullstack Software Engineer,https://www.topcv.vn/viec-lam/senior-fullstack-software-engineer/1894348.html?ta_source=JobSearchList_LinkDetail&u_sr_id=oS3w78gHBKaYXdp5EXo0hToC5hmwAC2b1FF5zEUm_1759549996,CÔNG TY CỔ PHẦN CYPHER AI LABS,Thoả thuận,Hà Nội,5 năm
Senior Frontend Developer (React.Js/Next.Js) - Mức Lương Upto 30M,https://www.topcv.vn/viec-lam/senior-frontend-developer-react-js-next-js-muc-luong-upto-30m/1771109.html?ta_source=JobSearchList_LinkDetail&u_sr_id=oS3w78gHBKaYXdp5EXo0hToC5hmwAC2b1FF5zEUm_1759549996,CÔNG TY TNHH VODAPLAY VIỆT NAM,Tới 30 triệu,Hà Nội,4 năm
"Sales Leader B2B/ Trưởng Nhóm Kinh Doanh Phần Mềm, Thu Nhập 15 - 40 Triệu, Nghỉ T7 & CN",https://www.topcv.vn/viec-lam/sales-leader-b2b-truong-nhom-kinh-doanh-phan-mem-thu-nhap-15-40-trieu-nghi-t7-cn/1882230.html?ta_source=JobSearchList_LinkDetail&u_sr_id=oS3w78gHBKaYXdp5EXo0hToC5hmwAC2b1FF5zEUm_1759549996,CÔNG TY TNHH CNV HOLDINGS,15 - 40 triệu,"Hồ Chí Minh, Hà Nội",Dưới 1 năm
Mobile Developer (Flutter)- Thu Nhập Up To 25tr- Tại Hà Nội,https://www.topcv.vn/viec-lam/mobile-developer-flutter-thu-nhap-up-to-25tr-tai-ha-noi/1891581.html?ta_source=JobSearchList_LinkDetail&u_sr_id=oS3w78gHBKaYXdp5EXo0hToC5hmwAC2b1FF5zEUm_1759549996,CÔNG TY TNHH 10KN,Tới 25 triệu,Hà Nội,3 năm
Nhân Viên Tư Vấn Triển Khai Phần Mềm (Có Đào Tạo),https://www.topcv.vn/viec-lam/nhan-vien-tu-van-trien-khai-phan-mem-co-dao-tao/1897777.html?ta_source=JobSearchList_LinkDetail&u_sr_id=oS3w78gHBKaYXdp5EXo0hToC5hmwAC2b1FF5zEUm_1759549996,CÔNG TY TNHH CÔNG NGHỆ PHẦN MỀM NASANI,8 - 25 triệu,Hồ Chí Minh,Không yêu cầu
"Chuyên Viên Kinh Doanh Hạ Tầng Công Nghê Thông Tin - Điện Nhẹ / Sales B2B - Tối Thiểu 2 Năm Kinh Nghiệm (Sinh Năm 1997 Trở Lên, Lương Cơ Bản Từ 10 Triệu + Thưởng, Thu Nhập Hấp Dẫn) - TP Hồ Chí Minh",https://www.topcv.vn/viec-lam/chuyen-vien-kinh-doanh-ha-tang-cong-nghe-thong-tin-dien-nhe-sales-b2b-toi-thieu-2-nam-kinh-nghiem-sinh-nam-1997-tro-len-luong-co-ban-tu-10-trieu-thuong-thu-nhap-hap-dan-tp-ho-chi-minh/1837535.html?ta_source=JobSearchList_LinkDetail&u_sr_id=oS3w78gHBKaYXdp5EXo0hToC5hmwAC2b1FF5zEUm_1759549996,CÔNG TY CỔ PHẦN MẠNG SÁNG TẠO EASYNET,Thoả thuận,Hồ Chí Minh,2 năm
IOS Developer (Swift/C++),https://www.topcv.vn/viec-lam/ios-developer-swift-c/1608572.html?ta_source=JobSearchList_LinkDetail&u_sr_id=oS3w78gHBKaYXdp5EXo0hToC5hmwAC2b1FF5zEUm_1759549996,CÔNG TY TNHH PHẦN MỀM TOWER HÀ NỘI,Thoả thuận,Hà Nội,2 năm
Website Developer Wordpress Shopify -Hà Nội / Thái Nguyên -  Lương 15 Triệu + Thưởng,https://www.topcv.vn/brand/maxbiocare/tuyen-dung/website-developer-wordpress-shopify-ha-noi-thai-nguyen-luong-15-trieu-thuong-j1796654.html?ta_source=JobSearchList_LinkDetail&u_sr_id=oS3w78gHBKaYXdp5EXo0hToC5hmwAC2b1FF5zEUm_1759549996,VĂN PHÒNG ĐẠI DIỆN MAX BIOCARE PTY LTD TẠI HÀ NỘI,15 - 20 triệu,"Thái Nguyên, Hà Nội",3 năm
Graphic Designer - Thu Nhập Từ 10-15 Triệu,https://www.topcv.vn/brand/maxbiocare/tuyen-dung/graphic-designer-thu-nhap-tu-10-15-trieu-j1796703.html?ta_source=JobSearchList_LinkDetail&u_sr_id=oS3w78gHBKaYXdp5EXo0hToC5hmwAC2b1FF5zEUm_1759549996,VĂN PHÒNG ĐẠI DIỆN MAX BIOCARE PTY LTD TẠI HÀ NỘI,10 - 15 triệu,Thái Nguyên,2 năm
"Middle Fullstack Java, 3 Năm Kinh Nghiệm, Lương 35M",https://www.topcv.vn/viec-lam/middle-fullstack-java-3-nam-kinh-nghiem-luong-35m/1885162.html?ta_source=JobSearchList_LinkDetail&u_sr_id=oS3w78gHBKaYXdp5EXo0hToC5hmwAC2b1FF5zEUm_1759549996,Công ty cổ phần Synodus,Tới 35 triệu,Hà Nội,3 năm
Quản Trị Mạng Xã Hội Kiêm Thu Ngân - Lương Upto 12tr - Tại Hà Nội,https://www.topcv.vn/viec-lam/quan-tri-mang-xa-hoi-kiem-thu-ngan-luong-upto-12tr-tai-ha-noi/1897594.html?ta_source=JobSearchList_LinkDetail&u_sr_id=oS3w78gHBKaYXdp5EXo0hToC5hmwAC2b1FF5zEUm_1759549996,CÔNG TY TNHH DU LỊCH VÀ KHÁCH SẠN LINH QUỲNH HƯNG,8 - 12 triệu,Hà Nội,1 năm
QA - Validation & Verification Engineer,https://www.topcv.vn/viec-lam/qa-validation-verification-engineer/1873287.html?ta_source=JobSearchList_LinkDetail&u_sr_id=oS3w78gHBKaYXdp5EXo0hToC5hmwAC2b1FF5zEUm_1759549996,"VĂN PHÒNG ĐẠI DIỆN KAON GROUP CO., LTD TẠI THÀNH PHỐ HÀ NỘI",Thoả thuận,Hà Nội,2 năm
[DI9] Senior Java Developer - DXDB - SI - MSB - 3I120,https://www.topcv.vn/viec-lam/di9-senior-java-developer-dxdb-si-msb-3i120/1895737.html?ta_source=JobSearchList_LinkDetail&u_sr_id=oS3w78gHBKaYXdp5EXo0hToC5hmwAC2b1FF5zEUm_1759549996,ProNgân hàng TMCP Hàng Hải Việt Nam (MSB),"1,000 - 2,000 USD",Hà Nội,3 năm
Quản Lý Dự Án Phần Mềm - Project Manager (Software),https://www.topcv.vn/viec-lam/quan-ly-du-an-phan-mem-project-manager-software/1894070.html?ta_source=JobSearchList_LinkDetail&u_sr_id=oS3w78gHBKaYXdp5EXo0hToC5hmwAC2b1FF5zEUm_1759549996,Công ty TNHH Smartbooks,"Tới 1,500 USD",Hà Nội,2 năm
"Backend Engineer (Tuyển Nhiều Level, Mảng Blockchain)",https://www.topcv.vn/viec-lam/backend-engineer-tuyen-nhieu-level-mang-blockchain/1852001.html?ta_source=JobSearchList_LinkDetail&u_sr_id=oS3w78gHBKaYXdp5EXo0hToC5hmwAC2b1FF5zEUm_1759549996,CÔNG TY CỔ PHẦN 1MATRIX,Thoả thuận,Hà Nội,3 năm
Senior Game Designer,https://www.topcv.vn/viec-lam/senior-game-designer/1889254.html?ta_source=JobSearchList_LinkDetail&u_sr_id=oS3w78gHBKaYXdp5EXo0hToC5hmwAC2b1FF5zEUm_1759549996,Công ty TNHH Skylink Group,Thoả thuận,Hồ Chí Minh,4 năm
Nhân Viên Kinh Doanh Kỹ Thuật (Lương Cứng Upto 18 Triệu + % Hoa Hồng Cao),https://www.topcv.vn/viec-lam/nhan-vien-kinh-doanh-ky-thuat-luong-cung-upto-18-trieu-hoa-hong-cao/1882590.html?ta_source=JobSearchList_LinkDetail&u_sr_id=oS3w78gHBKaYXdp5EXo0hToC5hmwAC2b1FF5zEUm_1759549996,Công ty TNHH công nghệ thông minh ICOMTECK,Thoả thuận,Hà Nội,1 năm
Gameplay Developer (C++),https://www.topcv.vn/viec-lam/gameplay-developer-c/1889187.html?ta_source=JobSearchList_LinkDetail&u_sr_id=oS3w78gHBKaYXdp5EXo0hToC5hmwAC2b1FF5zEUm_1759549996,Công ty TNHH Gameloft,Thoả thuận,Hồ Chí Minh,1 năm
Nhân Viên Kinh Doanh Thị Trường/ Direct Sales Thu Nhập Từ 10 -15 Triệu,https://www.topcv.vn/viec-lam/nhan-vien-kinh-doanh-thi-truong-direct-sales-thu-nhap-tu-10-15-trieu/1892230.html?ta_source=JobSearchList_LinkDetail&u_sr_id=oS3w78gHBKaYXdp5EXo0hToC5hmwAC2b1FF5zEUm_1759549996,CÔNG TY TNHH FINAN,10 - 15 triệu,Hồ Chí Minh,Dưới 1 năm
Senior Fullstack Developer PHP- Lương Up To 30tr-Có 2 Năm Kinh Nghiệm- Đi Làm Ngay,https://www.topcv.vn/viec-lam/senior-fullstack-developer-php-luong-up-to-30tr-co-2-nam-kinh-nghiem-di-lam-ngay/1895797.html?ta_source=JobSearchList_LinkDetail&u_sr_id=oS3w78gHBKaYXdp5EXo0hToC5hmwAC2b1FF5zEUm_1759549996,CÔNG TY TNHH TOP TALENT,20 - 30 triệu,Đồng Nai,3 năm
Chuyên Viên Website (Website Executive) - Thu Nhập 12 -18 Triệu,https://www.topcv.vn/viec-lam/chuyen-vien-website-website-executive-thu-nhap-12-18-trieu/1893829.html?ta_source=JobSearchList_LinkDetail&u_sr_id=oS3w78gHBKaYXdp5EXo0hToC5hmwAC2b1FF5zEUm_1759549996,CÔNG TY TNHH CARBON BILLIARDS,12 - 18 triệu,Hà Nội,2 năm
"Lập Trình Viên Fullstack (Từ 3 Năm Kinh Nghiệm, Thu Nhập 700-1500 USD)",https://www.topcv.vn/viec-lam/lap-trinh-vien-fullstack-tu-3-nam-kinh-nghiem-thu-nhap-700-1500-usd/1886652.html?ta_source=JobSearchList_LinkDetail&u_sr_id=oS3w78gHBKaYXdp5EXo0hToC5hmwAC2b1FF5zEUm_1759549996,CÔNG TY CỔ PHẦN SMART - SOLUTIONS VIỆT NAM,"700 - 1,500 USD",Hà Nội,3 năm
Trưởng Nhóm Marketing (FullStack-Marketing Leader) Thu Nhập Từ 30 - 35 Triệu,https://www.topcv.vn/viec-lam/truong-nhom-marketing-fullstack-marketing-leader-thu-nhap-tu-30-35-trieu/1881282.html?ta_source=JobSearchList_LinkDetail&u_sr_id=oS3w78gHBKaYXdp5EXo0hToC5hmwAC2b1FF5zEUm_1759549996,CÔNG TY TNHH H2T WEFUN MEDIA,Từ 30 triệu,Hà Nội,2 năm
Junior Fullstack Developer PHP- Lương Up To 15tr-Có 2 Năm Kinh Nghiệm- Đi Làm Ngay,https://www.topcv.vn/viec-lam/junior-fullstack-developer-php-luong-up-to-15tr-co-2-nam-kinh-nghiem-di-lam-ngay/1895796.html?ta_source=JobSearchList_LinkDetail&u_sr_id=oS3w78gHBKaYXdp5EXo0hToC5hmwAC2b1FF5zEUm_1759549996,CÔNG TY TNHH TOP TALENT,12 - 15 triệu,Đồng Nai,2 năm
Project Manager,https://www.topcv.vn/viec-lam/project-manager/1894492.html?ta_source=JobSearchList_LinkDetail&u_sr_id=oS3w78gHBKaYXdp5EXo0hToC5hmwAC2b1FF5zEUm_1759549996,Công ty CP Công nghệ phần mềm và nội dung số OSP,Tới 35 triệu,Hà Nội,2 năm
Chuyên Viên Thiết Kế 3D (Lương Upto 20 Triệu/Tháng),https://www.topcv.vn/viec-lam/chuyen-vien-thiet-ke-3d-luong-upto-20-trieu-thang/1816511.html?ta_source=JobSearchList_LinkDetail&u_sr_id=oS3w78gHBKaYXdp5EXo0hToC5hmwAC2b1FF5zEUm_1759549996,CÔNG TY CỔ PHẦN CANZY VIỆT NAM,15 - 20 triệu,Hà Nội,2 năm
AI Automation Marketing,https://www.topcv.vn/viec-lam/ai-automation-marketing/1898150.html?ta_source=JobSearchList_LinkDetail&u_sr_id=oS3w78gHBKaYXdp5EXo0hToC5hmwAC2b1FF5zEUm_1759549996,Khối Công nghệ thông tin - Viettel Telecom,Thoả thuận,Hà Nội,Không yêu cầu
Nhân Viên Kinh Doanh / Cross Selling - Giải Pháp Kế Toán/Hóa Đơn Điện Tử/Chữ Ký Số MISA (Data Có Sẵn),https://www.topcv.vn/brand/congtycophanmisa/tuyen-dung/nhan-vien-kinh-doanh-cross-selling-giai-phap-ke-toan-hoa-don-dien-tu-chu-ky-so-misa-data-co-san-j1891061.html?ta_source=JobSearchList_LinkDetail&u_sr_id=oS3w78gHBKaYXdp5EXo0hToC5hmwAC2b1FF5zEUm_1759549996,ProCông ty Cổ phần MISA,20 - 30 triệu,Hà Nội,Dưới 1 năm
Nhân Viên Gán Nhãn Dữ Liệu Tiếng Anh (Cấp Độ C1)- Thu Nhập 12- 14 Triệu/ Tháng- Đi Làm Ngay,https://www.topcv.vn/viec-lam/nhan-vien-gan-nhan-du-lieu-tieng-anh-cap-do-c1-thu-nhap-12-14-trieu-thang-di-lam-ngay/1882692.html?ta_source=JobSearchList_LinkDetail&u_sr_id=oS3w78gHBKaYXdp5EXo0hToC5hmwAC2b1FF5zEUm_1759549996,CÔNG TY TNHH APPEN DATA TECHNOLOGY VIỆT NAM,12 - 14 triệu,Hà Nội,Không yêu cầu
"Flutter Mobile Apps Developer (Android, IOS)",https://www.topcv.vn/viec-lam/flutter-mobile-apps-developer-android-ios/1897703.html?ta_source=JobSearchList_LinkDetail&u_sr_id=oS3w78gHBKaYXdp5EXo0hToC5hmwAC2b1FF5zEUm_1759549996,Công ty Cổ phần Công nghệ Tài chính Goline,14 - 22 triệu,Hà Nội,2 năm
"Nhân Viên Kinh Doanh Phần Mềm/ Sales B2B/ Nhân Viên Tư Vấn, Thu Nhập 15 - 40 Triệu, Nghỉ T7 Và CN, Đi Làm Ngay - Hà Nội",https://www.topcv.vn/viec-lam/nhan-vien-kinh-doanh-phan-mem-sales-b2b-nhan-vien-tu-van-thu-nhap-15-40-trieu-nghi-t7-va-cn-di-lam-ngay-ha-noi/1882185.html?ta_source=JobSearchList_LinkDetail&u_sr_id=oS3w78gHBKaYXdp5EXo0hToC5hmwAC2b1FF5zEUm_1759549996,CÔNG TY TNHH CNV HOLDINGS,15 - 40 triệu,Hà Nội,Dưới 1 năm
Nhân Viên Kinh Doanh Dự Án B2B (IT/Telecom),https://www.topcv.vn/viec-lam/nhan-vien-kinh-doanh-du-an-b2b-it-telecom/1807589.html?ta_source=JobSearchList_LinkDetail&u_sr_id=oS3w78gHBKaYXdp5EXo0hToC5hmwAC2b1FF5zEUm_1759549996,ProCông Ty TNHH MTV Viễn Thông Quốc Tế FPT,Thoả thuận,"Hồ Chí Minh, Hà Nội",2 năm
"Backend Java Developer (Springboot, SQL, Eclipse RCP)",https://www.topcv.vn/viec-lam/backend-java-developer-springboot-sql-eclipse-rcp/1730867.html?ta_source=JobSearchList_LinkDetail&u_sr_id=oS3w78gHBKaYXdp5EXo0hToC5hmwAC2b1FF5zEUm_1759549996,Công Ty TNHH LG CNS VIỆT NAM,Thoả thuận,Hà Nội,3 năm
"Lập Trình Viên Front End (Front End Developer) - Thu Nhập Cao 35 Triệu, Làm Ngay Tại Quận 10",https://www.topcv.vn/viec-lam/lap-trinh-vien-front-end-front-end-developer-thu-nhap-cao-35-trieu-lam-ngay-tai-quan-10/1893843.html?ta_source=JobSearchList_LinkDetail&u_sr_id=oS3w78gHBKaYXdp5EXo0hToC5hmwAC2b1FF5zEUm_1759549996,CÔNG TY CỔ PHẦN ĐT & PT LIA BEAUTY,20 - 35 triệu,Hồ Chí Minh,3 năm
Chuyên Viên Kinh Doanh Giải Pháp Chuyển Đổi Số Khối Cơ Quan Nhà Nước - Thu Nhập Lên Tới 50 Triệu,https://www.topcv.vn/brand/congtycophanmisa/tuyen-dung/chuyen-vien-kinh-doanh-giai-phap-chuyen-doi-so-khoi-co-quan-nha-nuoc-thu-nhap-len-toi-50-trieu-j1898307.html?ta_source=JobSearchList_LinkDetail&u_sr_id=oS3w78gHBKaYXdp5EXo0hToC5hmwAC2b1FF5zEUm_1759549996,ProCông ty Cổ phần MISA,Tới 50 triệu,"Hà Nội, Hồ Chí Minh",Không yêu cầu
Nhân Viên Kinh Doanh Tư Vấn Phần Mềm Thu Nhập Từ 10 - 15 Triệu,https://www.topcv.vn/viec-lam/nhan-vien-kinh-doanh-tu-van-phan-mem-thu-nhap-tu-10-15-trieu/1892221.html?ta_source=JobSearchList_LinkDetail&u_sr_id=oS3w78gHBKaYXdp5EXo0hToC5hmwAC2b1FF5zEUm_1759549996,CÔNG TY TNHH FINAN,10 - 15 triệu,Hồ Chí Minh,Dưới 1 năm
Junior AI Engineer,https://www.topcv.vn/viec-lam/junior-ai-engineer/1899483.html?ta_source=JobSearchList_LinkDetail&u_sr_id=oS3w78gHBKaYXdp5EXo0hToC5hmwAC2b1FF5zEUm_1759549996,CÔNG TY TNHH ARBIN INSTRUMENTS VIỆT NAM,Thoả thuận,Bình Dương,1 năm
Power Platform Developer - Hà Nội/ Hồ Chí Minh - Upto 60.000.000,https://www.topcv.vn/viec-lam/power-platform-developer-ha-noi-ho-chi-minh-upto-60-000-000/1895275.html?ta_source=JobSearchList_LinkDetail&u_sr_id=oS3w78gHBKaYXdp5EXo0hToC5hmwAC2b1FF5zEUm_1759549996,Công ty cổ phần Công nghệ thông tin Phú Minh (Phú Minh Teck),Tới 60 triệu,"Hà Nội, Hồ Chí Minh",2 năm
Chuyên Viên Nhập Liệu Data (Data Entry) - Fresher,https://www.topcv.vn/viec-lam/chuyen-vien-nhap-lieu-data-data-entry-fresher/1829148.html?ta_source=JobSearchList_LinkDetail&u_sr_id=oS3w78gHBKaYXdp5EXo0hToC5hmwAC2b1FF5zEUm_1759549996,Công ty TNHH Esoft Vietnam,11 - 13 triệu,Hà Nội,Dưới 1 năm
Chuyên Viên Telesales - Lương Trung Bình Upto 20 Triệu Đến Không Giới Hạn - Bình Thạnh (TPHCM),https://www.topcv.vn/viec-lam/chuyen-vien-telesales-luong-trung-binh-upto-20-trieu-den-khong-gioi-han-binh-thanh-tphcm/1899875.html?ta_source=JobSearchList_LinkDetail&u_sr_id=oS3w78gHBKaYXdp5EXo0hToC5hmwAC2b1FF5zEUm_1759549996,Công Ty TNHH NASYS,10 - 20 triệu,Hồ Chí Minh,1 năm
Kỹ Thuật Viên Lập Trình Và Vận Hành Máy CNC (Lương 10 - 12 Triệu) Đi Làm Ngay Tại Hà Nội,https://www.topcv.vn/viec-lam/ky-thuat-vien-lap-trinh-va-van-hanh-may-cnc-luong-10-12-trieu-di-lam-ngay-tai-ha-noi/1867623.html?ta_source=JobSearchList_LinkDetail&u_sr_id=oS3w78gHBKaYXdp5EXo0hToC5hmwAC2b1FF5zEUm_1759549996,CÔNG TY TNHH SẢN XUẤT NỘI THẤT MINH PHÁT,10 - 12 triệu,Hà Nội,1 năm
3D Artist - Thành Thạo Và Có Kỹ Năng Nâng Cao Với 3Ds Max Và V-Ray - Khu Vực Đà Nẵng,https://www.topcv.vn/viec-lam/3d-artist-thanh-thao-va-co-ky-nang-nang-cao-voi-3ds-max-va-v-ray-khu-vuc-da-nang/1871340.html?ta_source=JobSearchList_LinkDetail&u_sr_id=oS3w78gHBKaYXdp5EXo0hToC5hmwAC2b1FF5zEUm_1759549996,CÔNG TY CỔ PHẦN VENO3DS PRODUCTION,15 - 25 triệu,Đà Nẵng,3 năm
Kỹ Sư Mạng/Network Engineer - Kinh Nghiệm 3 Năm Trở Lên,https://www.topcv.vn/viec-lam/ky-su-mang-network-engineer-kinh-nghiem-3-nam-tro-len/1873559.html?ta_source=JobSearchList_LinkDetail&u_sr_id=oS3w78gHBKaYXdp5EXo0hToC5hmwAC2b1FF5zEUm_1759549996,Công ty TNHH Hanyang Digitech Vina,Thoả thuận,Phú Thọ,3 năm
Kỹ Thuật Lập Trình / Programmer Engineer (PE) Thu Nhập Từ 10 Đến 15 Triệu + Phụ Cấp + Thưởng Dự Án/Doanh ThuTại Hà Nội,https://www.topcv.vn/viec-lam/ky-thuat-lap-trinh-programmer-engineer-pe-thu-nhap-tu-10-den-15-trieu-phu-cap-thuong-du-an-doanh-thutai-ha-noi/1874451.html?ta_source=JobSearchList_LinkDetail&u_sr_id=oS3w78gHBKaYXdp5EXo0hToC5hmwAC2b1FF5zEUm_1759549996,Công ty Cổ phần AVPlus,10 - 15 triệu,Hà Nội,1 năm
"Nhân Viên Kinh Doanh Giải Pháp CNTT, Sales, Tư Vấn (Lương Cứng Từ 12 Triệu, Thu Nhập 20-50 Triệu+Thưởng)",https://www.topcv.vn/viec-lam/nhan-vien-kinh-doanh-giai-phap-cntt-sales-tu-van-luong-cung-tu-12-trieu-thu-nhap-20-50-trieu-thuong/1872132.html?ta_source=JobSearchList_LinkDetail&u_sr_id=oS3w78gHBKaYXdp5EXo0hToC5hmwAC2b1FF5zEUm_1759549996,Công ty Cổ phần Chứng thực số Toàn Cầu Việt Nam,20 - 50 triệu,Hà Nội,1 năm
Chuyên Viên An Toàn Thông Tin - Từ 2 Năm Kinh Nghiệm -  Đãi Ngộ Hấp Dẫn - Tại Hà Nội,https://www.topcv.vn/viec-lam/chuyen-vien-an-toan-thong-tin-tu-2-nam-kinh-nghiem-dai-ngo-hap-dan-tai-ha-noi/1830699.html?ta_source=JobSearchList_LinkDetail&u_sr_id=oS3w78gHBKaYXdp5EXo0hToC5hmwAC2b1FF5zEUm_1759549996,CÔNG TY TNHH DỊCH VỤ SỐ DIGILIFE VIỆT NAM,Thoả thuận,Hà Nội,2 năm
Quản Lý Dự Án (Yêu Cầu Biết Tiếng Hàn) - Lương Upto 30 Triệu/Tháng,https://www.topcv.vn/viec-lam/quan-ly-du-an-yeu-cau-biet-tieng-han-luong-upto-30-trieu-thang/1868249.html?ta_source=JobSearchList_LinkDetail&u_sr_id=oS3w78gHBKaYXdp5EXo0hToC5hmwAC2b1FF5zEUm_1759549996,CÔNG TY TNHH GKBEAUTY,20 - 30 triệu,Hồ Chí Minh,Không yêu cầu
"Automotive-Component Test Engineer (Tuyển Ứng Viên Nam, Trên 2 Năm Kinh Nghiệm Tester Automotive, MHU - Manual Test, ASPICE/AUTOSAR, Làm Việc Tại Long Biên-Hà Nội)",https://www.topcv.vn/viec-lam/automotive-component-test-engineer-tuyen-ung-vien-nam-tren-2-nam-kinh-nghiem-tester-automotive-mhu-manual-test-aspice-autosar-lam-viec-tai-long-bien-ha-noi/1697549.html?ta_source=JobSearchList_LinkDetail&u_sr_id=oS3w78gHBKaYXdp5EXo0hToC5hmwAC2b1FF5zEUm_1759549996,Công ty TNHH Vietsol,Thoả thuận,Hà Nội,2 năm
Kỹ Sư Trưởng Dự Án AI,https://www.topcv.vn/viec-lam/ky-su-truong-du-an-ai/1861433.html?ta_source=JobSearchList_LinkDetail&u_sr_id=oS3w78gHBKaYXdp5EXo0hToC5hmwAC2b1FF5zEUm_1759549996,CÔNG TY CỔ PHẦN ĐẦU TƯ PHÁT TRIỂN GIANG THÀNH,35 - 60 triệu,"Hồ Chí Minh, Hà Nội",5 năm
"Senior Java Engineer (Java 17, Java 21)",https://www.topcv.vn/viec-lam/senior-java-engineer-java-17-java-21/1899520.html?ta_source=JobSearchList_LinkDetail&u_sr_id=oS3w78gHBKaYXdp5EXo0hToC5hmwAC2b1FF5zEUm_1759549996,Công ty Cổ Phần Galaxy Technology Services,Thoả thuận,Hồ Chí Minh,5 năm
Senior Java Developer (Mảng Fintech) Thu Nhập Từ 30 - 45 Triệu,https://www.topcv.vn/viec-lam/senior-java-developer-mang-fintech-thu-nhap-tu-30-45-trieu/1560857.html?ta_source=JobSearchList_LinkDetail&u_sr_id=4EhhRhiH4H2fYrQed5gtnipdscjUXElSF1JMDHpz_1759550003,Công ty Cổ phần Funtap,30 - 45 triệu,Hà Nội,4 năm
Fullstack Developer (Java Spring Boot + ReactJS),https://www.topcv.vn/viec-lam/fullstack-developer-java-spring-boot-reactjs/1843702.html?ta_source=JobSearchList_LinkDetail&u_sr_id=4EhhRhiH4H2fYrQed5gtnipdscjUXElSF1JMDHpz_1759550003,ProFPT IS,Thoả thuận,Hà Nội,2 năm
Java Fullstack (Springboot + Vuejs) Max 25 Net,https://www.topcv.vn/viec-lam/java-fullstack-springboot-vuejs-max-25-net/1900112.html?ta_source=JobSearchList_LinkDetail&u_sr_id=4EhhRhiH4H2fYrQed5gtnipdscjUXElSF1JMDHpz_1759550003,Công ty Cổ phần Đầu tư Phát triển Công nghệ và Truyền thông,13 - 25 triệu,Hà Nội,2 năm
