title,link,company,salary,location,exp
Lập Trình Viên FRONT-END Developer Full Time,https://www.topcv.vn/viec-lam/lap-trinh-vien-front-end-developer-full-time/1900340.html?ta_source=JobSearchList_LinkDetail&u_sr_id=4EhhRhiH4H2fYrQed5gtnipdscjUXElSF1JMDHpz_1759550003,CÔNG TY TNHH PHỤ TÙNG Ô TÔ VC PART,20 - 24 triệu,Hà Nội,2 năm
Cocos Developer,https://www.topcv.vn/viec-lam/cocos-developer/1896447.html?ta_source=JobSearchList_LinkDetail&u_sr_id=4EhhRhiH4H2fYrQed5gtnipdscjUXElSF1JMDHpz_1759550003,CÔNG TY TNHH CÔNG NGHỆ HAY HAY GLOBAL,10 - 25 triệu,Hà Nội,Dưới 1 năm
Kỹ Sư Tự Động Hoá (Thiết Kế Điện & Lập Trình PLC) - Thu Nhập 15 - 20 Triệu,https://www.topcv.vn/viec-lam/ky-su-tu-dong-hoa-thiet-ke-dien-lap-trinh-plc-thu-nhap-15-20-trieu/1884018.html?ta_source=JobSearchList_LinkDetail&u_sr_id=4EhhRhiH4H2fYrQed5gtnipdscjUXElSF1JMDHpz_1759550003,Công ty TNHH YJ Link Vina,15 - 20 triệu,Hải Phòng,2 năm
"Team Lead - Kỹ Sư Phần Mềm Nhúng Phần Mềm Thiết Bị Y Tế (Hệ Điều Hành Thời Gian Thực , Phát Triển UI)",https://www.topcv.vn/viec-lam/team-lead-ky-su-phan-mem-nhung-phan-mem-thiet-bi-y-te-he-dieu-hanh-thoi-gian-thuc-phat-trien-ui/1889505.html?ta_source=JobSearchList_LinkDetail&u_sr_id=4EhhRhiH4H2fYrQed5gtnipdscjUXElSF1JMDHpz_1759550003,CTY TNHH R TECHNO VIỆT NAM,46 - 57.5 triệu,Hồ Chí Minh,5 năm
Junior Flutter Developer - Mobile App,https://www.topcv.vn/viec-lam/junior-flutter-developer-mobile-app/1883392.html?ta_source=JobSearchList_LinkDetail&u_sr_id=4EhhRhiH4H2fYrQed5gtnipdscjUXElSF1JMDHpz_1759550003,CÔNG TY CỔ PHẦN CÔNG NGHỆ VÀ TRUYỀN THÔNG NETVIET,10 - 17 triệu,Hà Nội,2 năm
Data Engineer (DA),https://www.topcv.vn/viec-lam/data-engineer-da/1821003.html?ta_source=JobSearchList_LinkDetail&u_sr_id=4EhhRhiH4H2fYrQed5gtnipdscjUXElSF1JMDHpz_1759550003,Công Ty TNHH LG CNS VIỆT NAM,Thoả thuận,Hà Nội,3 năm
Data Engineer (3 Năm Kinh Nghiệm Trở Lên),https://www.topcv.vn/viec-lam/data-engineer-3-nam-kinh-nghiem-tro-len/1895336.html?ta_source=JobSearchList_LinkDetail&u_sr_id=4EhhRhiH4H2fYrQed5gtnipdscjUXElSF1JMDHpz_1759550003,CÔNG TY TNHH BEYONDSOFT TECHNOLOGY (VIETNAM),"1,300 - 1,900 USD",Hồ Chí Minh,3 năm
Product Designer,https://www.topcv.vn/viec-lam/product-designer/1898738.html?ta_source=JobSearchList_LinkDetail&u_sr_id=4EhhRhiH4H2fYrQed5gtnipdscjUXElSF1JMDHpz_1759550003,CÔNG TY CP CÔNG NGHỆ GIÁO DỤC TRƯỜNG HỌC TRỰC TUYẾN - ONSCHOOL,15 - 20 triệu,Hồ Chí Minh,2 năm
Business Analyst (Giải Pháp Nhân Sự Tiền Lương),https://www.topcv.vn/viec-lam/business-analyst-giai-phap-nhan-su-tien-luong/1418016.html?ta_source=JobSearchList_LinkDetail&u_sr_id=4EhhRhiH4H2fYrQed5gtnipdscjUXElSF1JMDHpz_1759550003,ProFPT IS,Thoả thuận,Hà Nội,2 năm
Nhân Viên Business Analyst,https://www.topcv.vn/viec-lam/nhan-vien-business-analyst/1888495.html?ta_source=JobSearchList_LinkDetail&u_sr_id=4EhhRhiH4H2fYrQed5gtnipdscjUXElSF1JMDHpz_1759550003,CÔNG TY CỔ PHẦN ĐẦU TƯ PHÁT TRIỂN SKY CORPORATION,"Tới 1,500 USD",Hà Nội,3 năm
Nhân Viên Thiết Kế Bảng Biển Quảng Cáo,https://www.topcv.vn/viec-lam/nhan-vien-thiet-ke-bang-bien-quang-cao/1755443.html?ta_source=JobSearchList_LinkDetail&u_sr_id=4EhhRhiH4H2fYrQed5gtnipdscjUXElSF1JMDHpz_1759550003,Công ty CP Đầu tư & Phát triển Phú Hưng,12 - 15 triệu,Hà Nội,1 năm
Chuyên Viên Thiết Kế & Dựng Video Mảng BĐS - Ưu Tiên Nam - Thu Nhập Từ 12-18tr,https://www.topcv.vn/viec-lam/chuyen-vien-thiet-ke-dung-video-mang-bds-uu-tien-nam-thu-nhap-tu-12-18tr/1897288.html?ta_source=JobSearchList_LinkDetail&u_sr_id=4EhhRhiH4H2fYrQed5gtnipdscjUXElSF1JMDHpz_1759550003,CÔNG TY CỔ PHẦN THƯƠNG MẠI CAVITACO,12 - 18 triệu,Hà Nội,1 năm
Senior Android Developer (Kotlin/Java),https://www.topcv.vn/viec-lam/senior-android-developer-kotlin-java/1601507.html?ta_source=JobSearchList_LinkDetail&u_sr_id=4EhhRhiH4H2fYrQed5gtnipdscjUXElSF1JMDHpz_1759550003,CÔNG TY TNHH PHẦN MỀM TOWER HÀ NỘI,Thoả thuận,Hà Nội,2 năm
N2/N1 JLPT Business Analyst - Entry Level,https://www.topcv.vn/viec-lam/n2-n1-jlpt-business-analyst-entry-level/1899629.html?ta_source=JobSearchList_LinkDetail&u_sr_id=4EhhRhiH4H2fYrQed5gtnipdscjUXElSF1JMDHpz_1759550003,CÔNG TY TNHH CONARUM VIỆT NAM,Thoả thuận,Hồ Chí Minh,Không yêu cầu
UX/UI Designer - HaraSocial,https://www.topcv.vn/viec-lam/ux-ui-designer-harasocial/1899370.html?ta_source=JobSearchList_LinkDetail&u_sr_id=4EhhRhiH4H2fYrQed5gtnipdscjUXElSF1JMDHpz_1759550003,Công ty cổ phần Công nghệ Haravan,Thoả thuận,Hồ Chí Minh,2 năm
Business Analyst (Charging Station System),https://www.topcv.vn/viec-lam/business-analyst-charging-station-system/1900411.html?ta_source=JobSearchList_LinkDetail&u_sr_id=4EhhRhiH4H2fYrQed5gtnipdscjUXElSF1JMDHpz_1759550003,CÔNG TY CỔ PHẦN PHÁT TRIỂN TRẠM SẠC TOÀN CẦU V-GREEN,Thoả thuận,Hà Nội,2 năm
NodeJs Backend Developer,https://www.topcv.vn/viec-lam/nodejs-backend-developer/1584331.html?ta_source=JobSearchList_LinkDetail&u_sr_id=4EhhRhiH4H2fYrQed5gtnipdscjUXElSF1JMDHpz_1759550003,CÔNG TY CỔ PHẦN GIẢI PHÁP CÔNG NGHỆ ZENIFY,25 - 35 triệu,Hà Nội,4 năm
SAP SuccessFactors Consultant,https://www.topcv.vn/viec-lam/sap-successfactors-consultant/1727713.html?ta_source=JobSearchList_LinkDetail&u_sr_id=4EhhRhiH4H2fYrQed5gtnipdscjUXElSF1JMDHpz_1759550003,Công Ty TNHH LG CNS VIỆT NAM,Thoả thuận,Hà Nội,2 năm
Leader QA Biết Tiếng Nhật,https://www.topcv.vn/viec-lam/leader-qa-biet-tieng-nhat/1897722.html?ta_source=JobSearchList_LinkDetail&u_sr_id=4EhhRhiH4H2fYrQed5gtnipdscjUXElSF1JMDHpz_1759550003,CÔNG TY TNHH CÔNG NGHỆ AMCOLAB,12 - 20 triệu,Hà Nội,2 năm
"Unity Game Developer / Thu Nhập Đến 25 Triệu / Quận 2, Hồ Chí Minh",https://www.topcv.vn/viec-lam/unity-game-developer-thu-nhap-den-25-trieu-quan-2-ho-chi-minh/1662457.html?ta_source=JobSearchList_LinkDetail&u_sr_id=4EhhRhiH4H2fYrQed5gtnipdscjUXElSF1JMDHpz_1759550003,CÔNG TY TNHH SENSPARK,12 - 25 triệu,Hồ Chí Minh,2 năm
Chuyên Viên Đảm Bảo Chất Lượng Dịch Vụ Công Nghệ Thông Tin - Quality Assurance - Khối Công Nghệ Thông Tin (HO25.419),https://www.topcv.vn/brand/nganhangthuongmaicophanquandoi/tuyen-dung/chuyen-vien-dam-bao-chat-luong-dich-vu-cong-nghe-thong-tin-quality-assurance-khoi-cong-nghe-thong-tin-ho25-419-j1899260.html?ta_source=JobSearchList_LinkDetail&u_sr_id=4EhhRhiH4H2fYrQed5gtnipdscjUXElSF1JMDHpz_1759550003,ProNGÂN HÀNG TMCP QUÂN ĐỘI – MBBANK,Thoả thuận,Hà Nội,3 năm
"Senior Fullstack Developer-(ReactJs, NodeJs) Hybrid Working",https://www.topcv.vn/viec-lam/senior-fullstack-developer-reactjs-nodejs-hybrid-working/1899546.html?ta_source=JobSearchList_LinkDetail&u_sr_id=4EhhRhiH4H2fYrQed5gtnipdscjUXElSF1JMDHpz_1759550003,CÔNG TY TNHH THƯƠNG MẠI DỊCH VỤ VEXERE,Thoả thuận,Hồ Chí Minh,3 năm
UI UX Lead,https://www.topcv.vn/viec-lam/ui-ux-lead/1892977.html?ta_source=JobSearchList_LinkDetail&u_sr_id=4EhhRhiH4H2fYrQed5gtnipdscjUXElSF1JMDHpz_1759550003,Niteco,Thoả thuận,Hà Nội,Trên 5 năm
Talent BrSE/Kỹ Sư Cầu Nối Tài Năng (Lương Từ 15 - 25 Triệu),https://www.topcv.vn/viec-lam/talent-brse-ky-su-cau-noi-tai-nang-luong-tu-15-25-trieu/1882436.html?ta_source=JobSearchList_LinkDetail&u_sr_id=4EhhRhiH4H2fYrQed5gtnipdscjUXElSF1JMDHpz_1759550003,CÔNG TY CỔ PHẦN PHẦN MỀM LUVINA,15 - 25 triệu,Hà Nội,Không yêu cầu
Nhân Viên Lập Trình Và Setup Phay CNC - Mastercam,https://www.topcv.vn/viec-lam/nhan-vien-lap-trinh-va-setup-phay-cnc-mastercam/1806764.html?ta_source=JobSearchList_LinkDetail&u_sr_id=4EhhRhiH4H2fYrQed5gtnipdscjUXElSF1JMDHpz_1759550003,CÔNG TY TNHH CTI VN,15 - 25 triệu,Hồ Chí Minh,1 năm
Senior Product Designer,https://www.topcv.vn/viec-lam/senior-product-designer/1831115.html?ta_source=JobSearchList_LinkDetail&u_sr_id=4EhhRhiH4H2fYrQed5gtnipdscjUXElSF1JMDHpz_1759550003,Công ty TNHH Dịch vụ công nghệ TP,Thoả thuận,Hà Nội,3 năm
Python Developer,https://www.topcv.vn/viec-lam/python-developer/1897841.html?ta_source=JobSearchList_LinkDetail&u_sr_id=4EhhRhiH4H2fYrQed5gtnipdscjUXElSF1JMDHpz_1759550003,ProCÔNG TY TNHH SAMSUNG SDS VIỆT NAM,Thoả thuận,Hà Nội,Trên 5 năm
Senior/Lead NodeJS Backend Developer,https://www.topcv.vn/viec-lam/senior-lead-nodejs-backend-developer/1343931.html?ta_source=JobSearchList_LinkDetail&u_sr_id=4EhhRhiH4H2fYrQed5gtnipdscjUXElSF1JMDHpz_1759550003,CÔNG TY CỔ PHẦN CÔNG NGHỆ FINVIET,Tới 45 triệu,Hồ Chí Minh,Trên 5 năm
Thực Tập Sinh Tư Vấn Triển Khai Phần Mềm,https://www.topcv.vn/viec-lam/thuc-tap-sinh-tu-van-trien-khai-phan-mem/1897578.html?ta_source=JobSearchList_LinkDetail&u_sr_id=4EhhRhiH4H2fYrQed5gtnipdscjUXElSF1JMDHpz_1759550003,"Nina Co.,Ltd",4 - 20 triệu,Hồ Chí Minh,Không yêu cầu
.NET Developer - KV FnB,https://www.topcv.vn/viec-lam/net-developer-kv-fnb/1895722.html?ta_source=JobSearchList_LinkDetail&u_sr_id=4EhhRhiH4H2fYrQed5gtnipdscjUXElSF1JMDHpz_1759550003,Công ty Cổ phần Công nghệ KiotViet,20 - 40 triệu,Hà Nội,3 năm
AI Engineer (LLM/NLP) Từ 2 Năm Kinh Nghiệm,https://www.topcv.vn/viec-lam/ai-engineer-llm-nlp-tu-2-nam-kinh-nghiem/1899054.html?ta_source=JobSearchList_LinkDetail&u_sr_id=4EhhRhiH4H2fYrQed5gtnipdscjUXElSF1JMDHpz_1759550003,ProCông ty Cổ phần Đầu tư và Công nghệ HTI,Thoả thuận,Hà Nội,2 năm
User Acquisition Marketing (Mobile App) Upto 30 Triệu,https://www.topcv.vn/viec-lam/user-acquisition-marketing-mobile-app-upto-30-trieu/1893429.html?ta_source=JobSearchList_LinkDetail&u_sr_id=4EhhRhiH4H2fYrQed5gtnipdscjUXElSF1JMDHpz_1759550003,CÔNG TY CỔ PHẦN CÔNG NGHỆ ORECA,Thoả thuận,Hà Nội,1 năm
Nhân Viên Kinh Doanh Phần Mềm Quản Lý Tin Nhắn Zalo - Thu Nhập Hấp Dẫn - Tại Hà Nội,https://www.topcv.vn/viec-lam/nhan-vien-kinh-doanh-phan-mem-quan-ly-tin-nhan-zalo-thu-nhap-hap-dan-tai-ha-noi/1835011.html?ta_source=JobSearchList_LinkDetail&u_sr_id=4EhhRhiH4H2fYrQed5gtnipdscjUXElSF1JMDHpz_1759550003,Công ty cổ phần tập đoàn Media Soft,Thoả thuận,Hà Nội,Dưới 1 năm
Product Owner- Sản Phẩm AI Edtech,https://www.topcv.vn/viec-lam/product-owner-san-pham-ai-edtech/1899053.html?ta_source=JobSearchList_LinkDetail&u_sr_id=4EhhRhiH4H2fYrQed5gtnipdscjUXElSF1JMDHpz_1759550003,Babilala - Ứng dụng Tiếng Anh Online cho trẻ em tăng trưởng bậc nhất Đông Nam Á,30 - 40 triệu,Hà Nội,2 năm
Senior Odoo Developer,https://www.topcv.vn/viec-lam/senior-odoo-developer/1894145.html?ta_source=JobSearchList_LinkDetail&u_sr_id=4EhhRhiH4H2fYrQed5gtnipdscjUXElSF1JMDHpz_1759550003,Công ty Cổ phần Giải pháp Công nghệ TTC Việt Nam,Tới 40 triệu,Hà Nội,4 năm
".NET Developer (Product, Microservice)",https://www.topcv.vn/viec-lam/net-developer-product-microservice/1898752.html?ta_source=JobSearchList_LinkDetail&u_sr_id=4EhhRhiH4H2fYrQed5gtnipdscjUXElSF1JMDHpz_1759550003,Công ty Cổ phần Công nghệ KiotViet,20 - 35 triệu,Hà Nội,3 năm
Điều Phối Dự Án IT (Thu Nhập 12-18 Triệu/Tháng),https://www.topcv.vn/viec-lam/dieu-phoi-du-an-it-thu-nhap-12-18-trieu-thang/1759386.html?ta_source=JobSearchList_LinkDetail&u_sr_id=4EhhRhiH4H2fYrQed5gtnipdscjUXElSF1JMDHpz_1759550003,Công ty Cổ phần Giải pháp Công nghệ FANXIPAN Việt Nam,12 - 18 triệu,Hà Nội,2 năm
Chuyên Viên Thiết Kế / Designer,https://www.topcv.vn/viec-lam/chuyen-vien-thiet-ke-designer/1894812.html?ta_source=JobSearchList_LinkDetail&u_sr_id=4EhhRhiH4H2fYrQed5gtnipdscjUXElSF1JMDHpz_1759550003,CÔNG TY TNHH GIẢI PHÁP 1ON,10 - 12 triệu,Hồ Chí Minh,1 năm
Business Analyst,https://www.topcv.vn/viec-lam/business-analyst/1603539.html?ta_source=JobSearchList_LinkDetail&u_sr_id=4EhhRhiH4H2fYrQed5gtnipdscjUXElSF1JMDHpz_1759550003,ProFPT IS,Thoả thuận,Hồ Chí Minh,3 năm
Data Scientist,https://www.topcv.vn/viec-lam/data-scientist/1900027.html?ta_source=JobSearchList_LinkDetail&u_sr_id=4EhhRhiH4H2fYrQed5gtnipdscjUXElSF1JMDHpz_1759550003,Công ty Cổ phần JVB Việt Nam,15 - 25 triệu,Hà Nội,2 năm
Kỹ Sư Xử Lý Hình Ảnh Và Dữ Liệu Không Gian,https://www.topcv.vn/viec-lam/ky-su-xu-ly-hinh-anh-va-du-lieu-khong-gian/1899956.html?ta_source=JobSearchList_LinkDetail&u_sr_id=4EhhRhiH4H2fYrQed5gtnipdscjUXElSF1JMDHpz_1759550003,Công ty Cổ phần Tập đoàn OSB,Thoả thuận,Hà Nội,1 năm
Server Developer (C Language),https://www.topcv.vn/viec-lam/server-developer-c-language/1690802.html?ta_source=JobSearchList_LinkDetail&u_sr_id=4EhhRhiH4H2fYrQed5gtnipdscjUXElSF1JMDHpz_1759550003,CÔNG TY TNHH DAOUKIWOOM INNOVATION,22 - 45 triệu,Hồ Chí Minh,3 năm
Customer Relations (Real Estate Developer)/ Chăm Sóc Khách Hàng,https://www.topcv.vn/viec-lam/customer-relations-real-estate-developer-cham-soc-khach-hang/1897547.html?ta_source=JobSearchList_LinkDetail&u_sr_id=4EhhRhiH4H2fYrQed5gtnipdscjUXElSF1JMDHpz_1759550003,Công ty Cổ phần SetiaBecamex,10 - 15 triệu,Bình Dương,3 năm
Chuyên Viên Kinh Doanh Khách Hàng Doanh Nghiệp Lớn,https://www.topcv.vn/viec-lam/chuyen-vien-kinh-doanh-khach-hang-doanh-nghiep-lon/1888049.html?ta_source=JobSearchList_LinkDetail&u_sr_id=4EhhRhiH4H2fYrQed5gtnipdscjUXElSF1JMDHpz_1759550003,ProCông Ty Cổ Phần Đầu Tư Thương Mại Và Phát Triển Công Nghệ FSI,Thoả thuận,Hà Nội,3 năm
Software Engineer (Python/Backend) - Đi Làm Ngay Tại Bình Dương,https://www.topcv.vn/viec-lam/software-engineer-python-backend-di-lam-ngay-tai-binh-duong/1893772.html?ta_source=JobSearchList_LinkDetail&u_sr_id=4EhhRhiH4H2fYrQed5gtnipdscjUXElSF1JMDHpz_1759550003,Công ty Tnhh Tribeco Bình Dương,Thoả thuận,Bình Dương,3 năm
Senior/Middle Golang Developer,https://www.topcv.vn/viec-lam/senior-middle-golang-developer/1891907.html?ta_source=JobSearchList_LinkDetail&u_sr_id=4EhhRhiH4H2fYrQed5gtnipdscjUXElSF1JMDHpz_1759550003,ProCÔNG TY CỔ PHẦN CÔNG NGHỆ VI MÔ,18 - 35 triệu,Hà Nội,3 năm
Graphic Designer (Từ 1 Năm Kinh Nghiệm) 11 - 15 Triệu/Tháng,https://www.topcv.vn/brand/edutalkvn/tuyen-dung/graphic-designer-tu-1-nam-kinh-nghiem-11-15-trieu-thang-j1859596.html?ta_source=JobSearchList_LinkDetail&u_sr_id=4EhhRhiH4H2fYrQed5gtnipdscjUXElSF1JMDHpz_1759550003,CÔNG TY CỔ PHẦN TƯ VẤN ĐÁNH GIÁ VÀ PHÁT TRIỂN GIÁO DỤC EDUTALK,11 - 15 triệu,Hà Nội,1 năm
"Product Manager/Product Owner (SaaS, ERP)",https://www.topcv.vn/brand/congtycophanmisa/tuyen-dung/product-manager-product-owner-saas-erp-j1895241.html?ta_source=JobSearchList_LinkDetail&u_sr_id=OWFjZsRKAQncDoCDoIzhrTc8RmfYX35KjRhmF04p_1759550010,ProCông ty Cổ phần MISA,Thoả thuận,Hà Nội,1 năm
Nhân Viên Kinh Doanh - Kinh Nghiệm 2 Năm - Khu Vực Đà Nẵng,https://www.topcv.vn/viec-lam/nhan-vien-kinh-doanh-kinh-nghiem-2-nam-khu-vuc-da-nang/1882367.html?ta_source=JobSearchList_LinkDetail&u_sr_id=OWFjZsRKAQncDoCDoIzhrTc8RmfYX35KjRhmF04p_1759550010,Công Ty TNHH Giải Pháp Kết Nối,Thoả thuận,Đà Nẵng,2 năm
Chuyên Viên Phân Tích Dữ Liệu - Senior Business Analyst (Mảng Tài Chính - Ngân Hàng) - 4 Năm Kinh Nghiệm - Thu Nhập Lên Đến 50M++,https://www.topcv.vn/viec-lam/chuyen-vien-phan-tich-du-lieu-senior-business-analyst-mang-tai-chinh-ngan-hang-4-nam-kinh-nghiem-thu-nhap-len-den-50m/1874434.html?ta_source=JobSearchList_LinkDetail&u_sr_id=OWFjZsRKAQncDoCDoIzhrTc8RmfYX35KjRhmF04p_1759550010,Công ty Cổ Phần Giải Pháp Quản Lý SSG,30 - 50 triệu,Hà Nội,4 năm
Nhân Viên Quản Trị Hệ Thống Thông Tin,https://www.topcv.vn/viec-lam/nhan-vien-quan-tri-he-thong-thong-tin/1153243.html?ta_source=JobSearchList_LinkDetail&u_sr_id=OWFjZsRKAQncDoCDoIzhrTc8RmfYX35KjRhmF04p_1759550010,CÔNG TY CỔ PHẦN CÔNG NGHỆ VCS VIỆT NAM,Thoả thuận,Hà Nội,3 năm
Project Manager Officer (Quản Lý Dự Án) - Tại Hồ Chí Minh,https://www.topcv.vn/viec-lam/project-manager-officer-quan-ly-du-an-tai-ho-chi-minh/1887789.html?ta_source=JobSearchList_LinkDetail&u_sr_id=OWFjZsRKAQncDoCDoIzhrTc8RmfYX35KjRhmF04p_1759550010,CÔNG TY TNHH THANKSLAB VIỆT NAM,Thoả thuận,Hồ Chí Minh,5 năm
Business Analyst Leader (DMS Domain),https://www.topcv.vn/viec-lam/business-analyst-leader-dms-domain/1863288.html?ta_source=JobSearchList_LinkDetail&u_sr_id=OWFjZsRKAQncDoCDoIzhrTc8RmfYX35KjRhmF04p_1759550010,Công ty TNHH HQSOFT,Tới 40 triệu,Hồ Chí Minh,Trên 5 năm
Embedded Software Engineer (1 Year Contractor),https://www.topcv.vn/viec-lam/embedded-software-engineer-1-year-contractor/1886733.html?ta_source=JobSearchList_LinkDetail&u_sr_id=OWFjZsRKAQncDoCDoIzhrTc8RmfYX35KjRhmF04p_1759550010,CÔNG TY TNHH BOSCH GLOBAL SOFTWARE TECHNOLOGIES,Thoả thuận,Hồ Chí Minh,3 năm
Senior SAP MM Consultant (HCM/Hanoi),https://www.topcv.vn/viec-lam/senior-sap-mm-consultant-hcm-hanoi/1884093.html?ta_source=JobSearchList_LinkDetail&u_sr_id=OWFjZsRKAQncDoCDoIzhrTc8RmfYX35KjRhmF04p_1759550010,CÔNG TY TNHH BOSCH GLOBAL SOFTWARE TECHNOLOGIES,Thoả thuận,"Hồ Chí Minh, Hà Nội",5 năm
BI Developer (OAS/OBIEE),https://www.topcv.vn/viec-lam/bi-developer-oas-obiee/1832070.html?ta_source=JobSearchList_LinkDetail&u_sr_id=OWFjZsRKAQncDoCDoIzhrTc8RmfYX35KjRhmF04p_1759550010,ProFPT IS,Thoả thuận,Hà Nội,2 năm
Data Engineer (Kỹ Sư Dữ Liệu),https://www.topcv.vn/brand/educa/tuyen-dung/data-engineer-ky-su-du-lieu-j1885454.html?ta_source=JobSearchList_LinkDetail&u_sr_id=OWFjZsRKAQncDoCDoIzhrTc8RmfYX35KjRhmF04p_1759550010,EDUPIA,Tới 30 triệu,Hà Nội,3 năm
"Senior Software Engineer (Java, Angular) Upto 50M",https://www.topcv.vn/viec-lam/senior-software-engineer-java-angular-upto-50m/1855499.html?ta_source=JobSearchList_LinkDetail&u_sr_id=OWFjZsRKAQncDoCDoIzhrTc8RmfYX35KjRhmF04p_1759550010,CÔNG TY TNHH CNV HOLDINGS,30 - 50 triệu,Hồ Chí Minh,5 năm
Manual Tester (Có Tiếng Nhật),https://www.topcv.vn/viec-lam/manual-tester-co-tieng-nhat/1854122.html?ta_source=JobSearchList_LinkDetail&u_sr_id=OWFjZsRKAQncDoCDoIzhrTc8RmfYX35KjRhmF04p_1759550010,Công ty Cổ phần JVB Việt Nam,Tới 30 triệu,Hà Nội,1 năm
"Embedded Software Developer For AI App (Ít Nhất 1 Năm Kinh Nghiệm, Ko Nhận Fresher, C/C++, Python, Shell Script)",https://www.topcv.vn/viec-lam/embedded-software-developer-for-ai-app-it-nhat-1-nam-kinh-nghiem-ko-nhan-fresher-c-c-python-shell-script/1557688.html?ta_source=JobSearchList_LinkDetail&u_sr_id=OWFjZsRKAQncDoCDoIzhrTc8RmfYX35KjRhmF04p_1759550010,Công ty TNHH Vietsol,Thoả thuận,Hà Nội,1 năm
"Senior QA (3 Năm Kinh Nghiệm, Đi Làm Ngay)",https://www.topcv.vn/viec-lam/senior-qa-3-nam-kinh-nghiem-di-lam-ngay/1889276.html?ta_source=JobSearchList_LinkDetail&u_sr_id=OWFjZsRKAQncDoCDoIzhrTc8RmfYX35KjRhmF04p_1759550010,CÔNG TY CỔ PHẦN CÔNG NGHỆ DCORP,Thoả thuận,Hồ Chí Minh,3 năm
Nhân Viên Tư Vấn Website - Không Yêu Cầu Kinh Nghiệm,https://www.topcv.vn/viec-lam/nhan-vien-tu-van-website-khong-yeu-cau-kinh-nghiem/28632.html?ta_source=JobSearchList_LinkDetail&u_sr_id=OWFjZsRKAQncDoCDoIzhrTc8RmfYX35KjRhmF04p_1759550010,Công ty TNHH Thương Mại Và Dịch Vụ Nina,8.5 - 32.5 triệu,Hồ Chí Minh,Không yêu cầu
Chuyên Viên Cao Cấp An Toàn Thông Tin,https://www.topcv.vn/viec-lam/chuyen-vien-cao-cap-an-toan-thong-tin/1841975.html?ta_source=JobSearchList_LinkDetail&u_sr_id=OWFjZsRKAQncDoCDoIzhrTc8RmfYX35KjRhmF04p_1759550010,CÔNG TY CỔ PHẦN CHỨNG KHOÁN DẦU KHÍ (PSI),Thoả thuận,Hà Nội,3 năm
"Nhân Viên Dọn Máy, Dựng Máy Android - Hệ Thống Box Phone Farm (Đi Làm Ngay) Được Đào Tạo Nếu Không Biết Việc",https://www.topcv.vn/viec-lam/nhan-vien-don-may-dung-may-android-he-thong-box-phone-farm-di-lam-ngay-duoc-dao-tao-neu-khong-biet-viec/1892527.html?ta_source=JobSearchList_LinkDetail&u_sr_id=OWFjZsRKAQncDoCDoIzhrTc8RmfYX35KjRhmF04p_1759550010,CÔNG TY TNHH GIẢI PHÁP VÀ CÔNG NGHỆ BESTMOON,7 - 9 triệu,Hồ Chí Minh,Không yêu cầu
Workflow Automation Specialist (Focus On HR) Lương 15-20 Triệu,https://www.topcv.vn/viec-lam/workflow-automation-specialist-focus-on-hr-luong-15-20-trieu/1894622.html?ta_source=JobSearchList_LinkDetail&u_sr_id=OWFjZsRKAQncDoCDoIzhrTc8RmfYX35KjRhmF04p_1759550010,CÔNG TY CỔ PHẦN MẮT BÃO,15 - 20 triệu,Hồ Chí Minh,2 năm
Chuyên Viên Phân Tích Nghiệp Vụ (BA/PO)- Domain Bank,https://www.topcv.vn/viec-lam/chuyen-vien-phan-tich-nghiep-vu-ba-po-domain-bank/1886869.html?ta_source=JobSearchList_LinkDetail&u_sr_id=OWFjZsRKAQncDoCDoIzhrTc8RmfYX35KjRhmF04p_1759550010,Công Ty Cổ Phần GoGroup,15 - 30 triệu,Hà Nội,3 năm
Golang Developer (Blockchain/Web3),https://www.topcv.vn/viec-lam/golang-developer-blockchain-web3/1890675.html?ta_source=JobSearchList_LinkDetail&u_sr_id=OWFjZsRKAQncDoCDoIzhrTc8RmfYX35KjRhmF04p_1759550010,CÔNG TY TNHH NEXSOFT TECHNOLOGY,Thoả thuận,Hồ Chí Minh,5 năm
DevOps Engineer,https://www.topcv.vn/viec-lam/devops-engineer/1884711.html?ta_source=JobSearchList_LinkDetail&u_sr_id=OWFjZsRKAQncDoCDoIzhrTc8RmfYX35KjRhmF04p_1759550010,CÔNG TY CỔ PHẦN JARVIS GLOBAL,25 - 45 triệu,Hà Nội,2 năm
IT Support (Hosting),https://www.topcv.vn/viec-lam/it-support-hosting/1893654.html?ta_source=JobSearchList_LinkDetail&u_sr_id=OWFjZsRKAQncDoCDoIzhrTc8RmfYX35KjRhmF04p_1759550010,ProViettel IDC,Thoả thuận,Hà Nội,1 năm
Trưởng Phòng Phân Tích Dữ Liệu - Collection Data Analyst,https://www.topcv.vn/viec-lam/truong-phong-phan-tich-du-lieu-collection-data-analyst/1631299.html?ta_source=JobSearchList_LinkDetail&u_sr_id=OWFjZsRKAQncDoCDoIzhrTc8RmfYX35KjRhmF04p_1759550010,GALAXY DEBT TRADING COMPANY LIMITED,Thoả thuận,Hồ Chí Minh,2 năm
Chuyên Viên Vận Hành Hệ Thống SAP (PP-QM),https://www.topcv.vn/viec-lam/chuyen-vien-van-hanh-he-thong-sap-pp-qm/1888758.html?ta_source=JobSearchList_LinkDetail&u_sr_id=OWFjZsRKAQncDoCDoIzhrTc8RmfYX35KjRhmF04p_1759550010,Công ty Cổ phần Xuất nhập khẩu Bến Tre,Thoả thuận,Hồ Chí Minh,3 năm
Senior Full Stack JS Engineer,https://www.topcv.vn/viec-lam/senior-full-stack-js-engineer/1885249.html?ta_source=JobSearchList_LinkDetail&u_sr_id=OWFjZsRKAQncDoCDoIzhrTc8RmfYX35KjRhmF04p_1759550010,Công ty Cổ phần GEM,"900 - 2,100 USD","Hà Nội, Hồ Chí Minh",3 năm
Senior .NET Developer,https://www.topcv.vn/viec-lam/senior-net-developer/1890277.html?ta_source=JobSearchList_LinkDetail&u_sr_id=OWFjZsRKAQncDoCDoIzhrTc8RmfYX35KjRhmF04p_1759550010,Công ty Cổ phần VNEXT SOFTWARE,Tới 35 triệu,Hà Nội,5 năm
Junior Salesforce Developer,https://www.topcv.vn/viec-lam/junior-salesforce-developer/1745091.html?ta_source=JobSearchList_LinkDetail&u_sr_id=OWFjZsRKAQncDoCDoIzhrTc8RmfYX35KjRhmF04p_1759550010,Công Ty TNHH Avepoint Việt Nam,Thoả thuận,"Hà Nội, Đà Nẵng",Dưới 1 năm
"Thiết Kế Đồ Họa 2D - Khu Vực Phạm Hùng, Quận 8",https://www.topcv.vn/viec-lam/thiet-ke-do-hoa-2d-khu-vuc-pham-hung-quan-8/1893109.html?ta_source=JobSearchList_LinkDetail&u_sr_id=OWFjZsRKAQncDoCDoIzhrTc8RmfYX35KjRhmF04p_1759550010,CÔNG TY TNHH THƯƠNG MẠI DỊCH VỤ KHA LINH,9 - 15 triệu,Hồ Chí Minh,1 năm
Lập Trình Viên Nodejs Kn 2 Năm,https://www.topcv.vn/viec-lam/lap-trinh-vien-nodejs-kn-2-nam/1857055.html?ta_source=JobSearchList_LinkDetail&u_sr_id=OWFjZsRKAQncDoCDoIzhrTc8RmfYX35KjRhmF04p_1759550010,Công ty cổ phần giải pháp MKT,10 - 20 triệu,Hà Nội,2 năm
Data /MLops Engineer - Salary Upto 30M,https://www.topcv.vn/viec-lam/data-mlops-engineer-salary-upto-30m/1501256.html?ta_source=JobSearchList_LinkDetail&u_sr_id=OWFjZsRKAQncDoCDoIzhrTc8RmfYX35KjRhmF04p_1759550010,CÔNG TY CỔ PHẦN CÔNG NGHỆ UPP TOÀN CẦU,Tới 30 triệu,Hà Nội,2 năm
Nhân Viên Thiết Kế (UI/UX Designer),https://www.topcv.vn/viec-lam/nhan-vien-thiet-ke-ui-ux-designer/1674592.html?ta_source=JobSearchList_LinkDetail&u_sr_id=OWFjZsRKAQncDoCDoIzhrTc8RmfYX35KjRhmF04p_1759550010,CÔNG TY TNHH ZAM MART (VIỆT NAM),12 - 15 triệu,Hồ Chí Minh,2 năm
Graphic & 3D Designer (Quận 7),https://www.topcv.vn/viec-lam/graphic-3d-designer-quan-7/1882974.html?ta_source=JobSearchList_LinkDetail&u_sr_id=OWFjZsRKAQncDoCDoIzhrTc8RmfYX35KjRhmF04p_1759550010,CÔNG TY TNHH THƯƠNG MẠI THỂ THAO HỒNG ÂN,Thoả thuận,Hồ Chí Minh,2 năm
Flutter Developer (Web3 ),https://www.topcv.vn/viec-lam/flutter-developer-web3/1890622.html?ta_source=JobSearchList_LinkDetail&u_sr_id=OWFjZsRKAQncDoCDoIzhrTc8RmfYX35KjRhmF04p_1759550010,CÔNG TY TNHH NEXSOFT TECHNOLOGY,Thoả thuận,Hồ Chí Minh,2 năm
Devops Engineer (Mảng Fintech) Lương Up To 45 Triệu,https://www.topcv.vn/viec-lam/devops-engineer-mang-fintech-luong-up-to-45-trieu/1855543.html?ta_source=JobSearchList_LinkDetail&u_sr_id=OWFjZsRKAQncDoCDoIzhrTc8RmfYX35KjRhmF04p_1759550010,Công ty Cổ phần Funtap,30 - 45 triệu,Hà Nội,4 năm
Kỹ Sư Kiểm Thử Phần Mềm ( QA/ Tester),https://www.topcv.vn/viec-lam/ky-su-kiem-thu-phan-mem-qa-tester/1886559.html?ta_source=JobSearchList_LinkDetail&u_sr_id=OWFjZsRKAQncDoCDoIzhrTc8RmfYX35KjRhmF04p_1759550010,CÔNG TY TNHH MỘT THÀNH VIÊN AN NINH MẠNG VIETTEL,Thoả thuận,Hà Nội,3 năm
Senior IOS Developer,https://www.topcv.vn/viec-lam/senior-ios-developer/1893297.html?ta_source=JobSearchList_LinkDetail&u_sr_id=OWFjZsRKAQncDoCDoIzhrTc8RmfYX35KjRhmF04p_1759550010,Apero Technologies Group,35 - 55 triệu,Hồ Chí Minh,4 năm
Technical Support Engineer,https://www.topcv.vn/viec-lam/technical-support-engineer/1866458.html?ta_source=JobSearchList_LinkDetail&u_sr_id=OWFjZsRKAQncDoCDoIzhrTc8RmfYX35KjRhmF04p_1759550010,Công Ty TNHH Avepoint Việt Nam,Thoả thuận,"Đà Nẵng, Hà Nội",1 năm
