title,link,company,salary,location,exp
"[Middle, Senior] Mobile Developer  - (Flutter, React Native) - Khối Công Nghệ Thông Tin (HO25.397)",https://www.topcv.vn/brand/nganhangthuongmaicophanquandoi/tuyen-dung/middle-senior-mobile-developer-flutter-react-native-khoi-cong-nghe-thong-tin-ho25-397-j1887182.html?ta_source=JobSearchList_LinkDetail&u_sr_id=OWFjZsRKAQncDoCDoIzhrTc8RmfYX35KjRhmF04p_1759550010,ProNGÂN HÀNG TMCP QUÂN ĐỘI – MBBANK,Thoả thuận,Hà Nội,2 năm
IT Helpdesk (Tiếng Anh Giao Tiếp),https://www.topcv.vn/viec-lam/it-helpdesk-tieng-anh-giao-tiep/1860919.html?ta_source=JobSearchList_LinkDetail&u_sr_id=OWFjZsRKAQncDoCDoIzhrTc8RmfYX35KjRhmF04p_1759550010,Công ty TNHH Tổng công ty Công nghệ & Giải pháp CMC,Tới 12 triệu,Hà Nội,1 năm
AI & Automation Specialist (AI Engineer),https://www.topcv.vn/viec-lam/ai-automation-specialist-ai-engineer/1885169.html?ta_source=JobSearchList_LinkDetail&u_sr_id=OWFjZsRKAQncDoCDoIzhrTc8RmfYX35KjRhmF04p_1759550010,Công ty Cổ phần SEONGON Thịnh Vượng,15 - 20 triệu,Hà Nội,3 năm
"Tester Tiếng Nhật (N2, Không Yêu Cầu Kinh Nghiệm)",https://www.topcv.vn/viec-lam/tester-tieng-nhat-n2-khong-yeu-cau-kinh-nghiem/1070465.html?ta_source=JobSearchList_LinkDetail&u_sr_id=OWFjZsRKAQncDoCDoIzhrTc8RmfYX35KjRhmF04p_1759550010,CÔNG TY CỔ PHẦN OMINEXT,Thoả thuận,Hà Nội,Không yêu cầu
Business Analyst (Finance/ Banking),https://www.topcv.vn/viec-lam/business-analyst-finance-banking/1885233.html?ta_source=JobSearchList_LinkDetail&u_sr_id=OWFjZsRKAQncDoCDoIzhrTc8RmfYX35KjRhmF04p_1759550010,ProFPT IS,Thoả thuận,Hà Nội,2 năm
"Backend Developer - Cloud Product (Golang, Java)",https://www.topcv.vn/viec-lam/backend-developer-cloud-product-golang-java/1351473.html?ta_source=JobSearchList_LinkDetail&u_sr_id=OWFjZsRKAQncDoCDoIzhrTc8RmfYX35KjRhmF04p_1759550010,ProCông ty cổ phần Hạ tầng Viễn thông CMC Telecom,25 - 40 triệu,Hà Nội,3 năm
Chuyên Viên Phân Tích Nhiệp Vụ (BA) - Domain Bank,https://www.topcv.vn/viec-lam/chuyen-vien-phan-tich-nhiep-vu-ba-domain-bank/1864953.html?ta_source=JobSearchList_LinkDetail&u_sr_id=OWFjZsRKAQncDoCDoIzhrTc8RmfYX35KjRhmF04p_1759550010,Công Ty Cổ Phần GoGroup,12 - 30 triệu,Hà Nội,3 năm
Chuyên Viên Kiểm Soát Chất Lượng (Tester) Tại Hà Nội,https://www.topcv.vn/viec-lam/chuyen-vien-kiem-soat-chat-luong-tester-tai-ha-noi/1894531.html?ta_source=JobSearchList_LinkDetail&u_sr_id=OWFjZsRKAQncDoCDoIzhrTc8RmfYX35KjRhmF04p_1759550010,Công ty Cổ phần Công nghệ Pavana,Thoả thuận,Hà Nội,2 năm
.NET Developer (Build Product),https://www.topcv.vn/viec-lam/net-developer-build-product/1868362.html?ta_source=JobSearchList_LinkDetail&u_sr_id=OWFjZsRKAQncDoCDoIzhrTc8RmfYX35KjRhmF04p_1759550010,Công ty Cổ phần Công nghệ KiotViet,25 - 40 triệu,Hà Nội,3 năm
Data Scientist,https://www.topcv.vn/viec-lam/data-scientist/1890311.html?ta_source=JobSearchList_LinkDetail&u_sr_id=OWFjZsRKAQncDoCDoIzhrTc8RmfYX35KjRhmF04p_1759550010,ProCông ty CP Giải pháp Thanh toán Việt Nam (VNPAY),Thoả thuận,Hà Nội,1 năm
Thực Tập Sinh Công Nghệ Thông Tin,https://www.topcv.vn/viec-lam/thuc-tap-sinh-cong-nghe-thong-tin/1737030.html?ta_source=JobSearchList_LinkDetail&u_sr_id=OWFjZsRKAQncDoCDoIzhrTc8RmfYX35KjRhmF04p_1759550010,CÔNG TY TNHH TM & DV NINA,Thoả thuận,Hồ Chí Minh,Không yêu cầu
Lập Trình Viên Java Fullstack Đi Làm Ngay - Upto 32M,https://www.topcv.vn/viec-lam/lap-trinh-vien-java-fullstack-di-lam-ngay-upto-32m/1272480.html?ta_source=JobSearchList_LinkDetail&u_sr_id=OWFjZsRKAQncDoCDoIzhrTc8RmfYX35KjRhmF04p_1759550010,Công ty cổ phần phần mềm REVOTECH,Tới 32 triệu,Hà Nội,3 năm
Lập Trình Viên Backend .Net Senior,https://www.topcv.vn/viec-lam/lap-trinh-vien-backend-net-senior/1891935.html?ta_source=JobSearchList_LinkDetail&u_sr_id=OWFjZsRKAQncDoCDoIzhrTc8RmfYX35KjRhmF04p_1759550010,Công ty VTC Online,25 - 40 triệu,Hà Nội,5 năm
